account_id,account_name,email,created_at,updated_at
19,Fernandez y asociados S.A.D Modificado,hermanosbernals.l.n.e@outlook.com,2024-08-17 05:57:04,2025-12-27 05:07:28
28,Solana y asociados S.A. Modificado,paolareigsosas.com.@gmail.com,2020-05-19 11:42:08,2025-12-27 05:07:28
43,Gerónimo Izquierdo Valencia S.Com. Modificado,cañasypellicers.l.@hotmail.com,2022-07-27 18:06:35,2025-12-27 05:07:28
52,Grupo Reina S.Com. Modificado,jennybarrancoestévezs.com.@hotmail.com,2024-01-22 19:38:22,2025-12-27 05:07:28
65,Familia Riera S.L.L. Modificado,instalacionespriegos.l.@hotmail.com,2022-03-27 02:31:30,2025-12-27 05:07:28
75,Minería MMIC S.L.L. Modificado,familiasegovias.a.@outlook.com,2022-08-04 09:41:00,2025-12-27 05:07:28
78,Comercializadora Montaña S.L. Modificado,yusteypereas.com.@outlook.com,2024-03-27 00:39:40,2025-12-27 05:07:28
96,Inversiones Alonso S.Coop. Modificado,inversionespdexs.c.p@hotmail.com,2022-04-08 01:41:07,2025-12-27 05:07:28
108,Inversiones Iñiguez S.Coop. Modificado,manufacturassáenzs.coop.@gmail.com,2021-01-21 12:03:31,2025-12-27 05:07:28
115,Castell y Maestre S.Coop. Modificado,plazayasociadoss.a.d@hotmail.com,2024-05-28 04:02:35,2025-12-27 05:07:28
117,Inmobiliaria Amigó S.Com. Modificado,industriasxzfws.com.@gmail.com,2021-11-27 14:30:45,2025-12-27 05:07:28
120,Fátima Gimeno Escudero S.L. Modificado,familiamartís.l.n.e@gmail.com,2023-10-15 15:00:32,2025-12-27 05:07:28
125,Infraestructuras SS S.A. Modificado,inmobiliariagus.l.@outlook.com,2021-12-05 09:15:38,2025-12-27 05:07:28
130,Rocha y asociados S.Com. Modificado,supermercadosmontesinos&asociadoss.a.@hotmail.com,2024-06-16 23:39:09,2025-12-27 05:07:28
131,Banco IX S.L. Modificado,hermanosseguís.com.@gmail.com,2021-09-10 02:51:25,2025-12-27 05:07:28
148,Amigó & Asociados S.L.N.E Modificado,supermercadosdelnoroestes.l.@hotmail.com,2020-10-19 15:26:36,2025-12-27 05:07:28
154,Benitez & Asociados S.Com. Modificado,torralbayasociadoss.a.@hotmail.com,2023-08-08 23:18:07,2025-12-27 05:07:28
158,Talleres TWCK S.Com. Modificado,instalacionesibéricas.coop.@gmail.com,2023-07-18 11:08:35,2025-12-27 05:07:28
166,Castillo y Gallardo S.L. Modificado,suministrosamadors.l.@outlook.com,2020-03-14 06:17:44,2025-12-27 05:07:28
173,Fábrica Españolas S.Coop. Modificado,supermercadosviqs.l.n.e@outlook.com,2020-04-27 12:33:55,2025-12-27 05:07:28
180,Soluciones del Norte S.A. Modificado,infraestructuraslozanoyasociadoss.l.@outlook.com,2021-11-28 15:40:04,2025-12-27 05:07:28
181,Transportes Sancho S.Com. Modificado,hermanosmaciass.c.p@outlook.com,2022-02-19 10:10:25,2025-12-27 05:07:28
188,Paco Losa Segarra S.Coop. Modificado,inversionesiniesta&asociadoss.com.@outlook.com,2022-03-31 16:15:42,2025-12-27 05:07:28
205,Inmobiliaria HCI S.L.L. Modificado,despachoherass.com.@hotmail.com,2022-05-16 17:04:25,2025-12-27 05:07:28
214,Manufacturas Toro y asociados S.Coop. Modificado,amayavallsegeas.a.@outlook.com,2023-05-17 15:36:53,2025-12-27 05:07:28
216,Urbano Anguita Niño S.L. Modificado,adeliaríocuencas.l.@hotmail.com,2022-03-16 18:34:49,2025-12-27 05:07:28
221,Transportes Morata S.L.L. Modificado,grupodiazs.coop.@gmail.com,2020-02-13 14:51:36,2025-12-27 05:07:28
235,Logística AK S.A. Modificado,solucioneszigbs.com.@outlook.com,2021-01-09 14:53:01,2025-12-27 05:07:28
245,Familia Bustamante S.L. Modificado,arenasygayas.com.@outlook.com,2023-11-14 23:53:32,2025-12-27 05:07:28
253,Suministros Bosch S.A. Modificado,mineríaamadors.a.@outlook.com,2021-02-12 10:44:30,2025-12-27 05:07:28
254,Promociones del Norte S.L.N.E Modificado,mosquerayabelláns.a.@gmail.com,2021-12-17 13:42:04,2025-12-27 05:07:28
265,Farmaceútica Coronado & Asociados S.Coop. Modificado,ruycarbajofabregats.l.@outlook.com,2024-12-10 14:30:23,2025-12-27 05:07:28
266,Castro y Leon S.L. Modificado,tomásypombos.a.@outlook.com,2021-11-15 09:03:22,2025-12-27 05:07:28
270,Comercializadora Lucena & Asociados S.A. Modificado,logísticainternacionaless.a.@gmail.com,2022-07-25 04:40:29,2025-12-27 05:07:28
284,Hermanos Melero S.A.T. Modificado,mineríajuárezs.l.l.@outlook.com,2022-05-28 02:01:10,2025-12-27 05:07:28
289,Transportes Figueroa y asociados S.L. Modificado,olivares&asociadoss.com.@gmail.com,2023-07-29 11:07:40,2025-12-27 05:07:28
291,Farmaceútica Almagro y asociados S.A. Modificado,botellaycamachos.l.@hotmail.com,2020-04-12 14:56:49,2025-12-27 05:07:28
299,Manufacturas Taboada S.A. Modificado,bancoizaguirres.l.l.@hotmail.com,2024-11-14 14:24:29,2025-12-27 05:07:28
312,Tecnologías Blanch y asociados S.A. Modificado,serviciosthds.com.@gmail.com,2021-07-30 12:07:59,2025-12-27 05:07:28
317,María Carmen Bayona Figueras S.Coop. Modificado,mesayasociadoss.com.@hotmail.com,2020-02-04 03:39:44,2025-12-27 05:07:28
344,Promociones Fábregas y asociados S.L.N.E Modificado,priego&asociadoss.a.@outlook.com,2021-07-13 08:05:10,2025-12-27 05:07:28
356,Duque y asociados S.C.P Modificado,serviciostéllezyasociadoss.a.@outlook.com,2020-08-20 17:17:07,2025-12-27 05:07:28
369,Grupo Chaves S.A. Modificado,baltasariñiguezmancebos.l.@hotmail.com,2023-06-15 02:17:42,2025-12-27 05:07:28
387,Distribuciones WWA S.Coop. Modificado,serviciosrequenayasociadoss.a.@outlook.com,2022-02-12 14:04:11,2025-12-27 05:07:28
399,Fábrica DS S.L.L. Modificado,transportesespañolass.com.@outlook.com,2022-03-01 05:15:11,2025-12-27 05:07:28
400,Farmaceútica Globales S.L.N.E Modificado,palmirapalacioportillos.l.n.e@outlook.com,2022-01-10 06:19:36,2025-12-27 05:07:28
411,Hnos Oliveras S.A. Modificado,comercialolivera&asociadoss.c.p@outlook.com,2024-05-25 12:43:00,2025-12-27 05:07:28
415,Minería Somoza S.A. Modificado,logísticapazoss.l.u.@outlook.com,2022-11-01 20:53:08,2025-12-27 05:07:28
433,Cañete y Bustamante S.L.N.E Modificado,supermercadosxovs.l.n.e@outlook.com,2024-01-22 01:05:28,2025-12-27 05:07:28
440,Minería Españolas S.L. Modificado,hermanosmanzanos.com.@outlook.com,2021-09-30 20:06:01,2025-12-27 05:07:28
456,Arnaiz y Montesinos S.Coop. Modificado,construcciónsegovias.a.@hotmail.com,2021-08-31 17:02:50,2025-12-27 05:07:28
460,Huerta y Jaume S.L. Modificado,inmobiliariafjcs.l.n.e@outlook.com,2020-05-06 03:20:15,2025-12-27 05:07:28
471,Cifuentes y Bello S.A. Modificado,compañíainternacionaless.l.@outlook.com,2020-07-31 22:44:42,2025-12-27 05:07:28
508,Consultoría Cueto y asociados S.A. Modificado,cabezayvalenzuelas.coop.@gmail.com,2023-03-04 17:18:23,2025-12-27 05:07:28
509,Compañía Vallejo & Asociados S.Coop. Modificado,ikerpolguerreros.coop.@gmail.com,2023-08-20 13:56:15,2025-12-27 05:07:28
515,Pujol y Ricart S.Com. Modificado,promocionesafs.l.n.e@outlook.com,2021-02-26 23:10:34,2025-12-27 05:07:28
525,Ramiro Riba Quintanilla S.L. Modificado,desarrollolazhs.a.@gmail.com,2022-10-12 11:44:27,2025-12-27 05:07:28
540,Industrias XVI S.C.P Modificado,florencioguardiolallorets.com.@gmail.com,2021-05-03 12:31:04,2025-12-27 05:07:28
563,Hotel Bru & Asociados S.Coop. Modificado,industriashiguerasyasociadoss.l.n.e@hotmail.com,2022-03-09 19:05:02,2025-12-27 05:07:28
572,Promociones Zurita S.Coop. Modificado,marinoperalmascarós.a.@outlook.com,2021-12-26 23:06:41,2025-12-27 05:07:28
579,Grupo Soria S.L.N.E Modificado,suministroslwvhs.com.@hotmail.com,2022-04-15 01:33:01,2025-12-27 05:07:28
583,Comercial Ibéricos S.L.N.E Modificado,restauraciónamores&asociadoss.com.@gmail.com,2021-07-10 09:26:18,2025-12-27 05:07:28
588,Promociones Internacionales S.L.U. Modificado,domingoyasociadoss.l.@hotmail.com,2024-08-17 20:20:01,2025-12-27 05:07:28
597,Banco Saez y asociados S.A. Modificado,pascualredondosedanos.l.n.e@hotmail.com,2023-03-25 09:12:56,2025-12-27 05:07:28
604,Banco Ibéricos S.L. Modificado,hotelcastellanas.a.@outlook.com,2020-09-09 00:04:21,2025-12-27 05:07:28
611,Febe Mármol Manrique S.A. Modificado,comercialugarte&asociadoss.c.p@gmail.com,2020-09-24 12:22:24,2025-12-27 05:07:28
615,Familia Mosquera S.Coop. Modificado,farmaceúticamercader&asociadoss.a.@hotmail.com,2023-06-11 08:08:37,2025-12-27 05:07:28
616,Distribuciones Portero & Asociados S.Com. Modificado,instalacionesviñass.coop.@hotmail.com,2023-11-19 03:19:43,2025-12-27 05:07:28
639,Compañía Seguí y asociados S.Coop. Modificado,despachointeligentess.a.@hotmail.com,2021-10-03 06:27:17,2025-12-27 05:07:28
648,Jaén & Asociados S.A. Modificado,industriasespañolas.a.@gmail.com,2023-12-23 22:11:05,2025-12-27 05:07:28
653,Saturnina Bou Salmerón S.Coop. Modificado,finanzasleóns.l.u.@hotmail.com,2020-12-13 01:39:18,2025-12-27 05:07:28
657,Desarrollo Arellano y asociados S.A. Modificado,familiapachecos.c.p@outlook.com,2022-11-08 16:28:39,2025-12-27 05:07:28
666,Campoy & Asociados S.A. Modificado,aurapuertasanchezs.l.u.@gmail.com,2020-05-21 18:10:08,2025-12-27 05:07:28
668,Maristela Ruiz Villalonga S.A. Modificado,familiasanjuans.l.n.e@hotmail.com,2022-02-26 18:07:24,2025-12-27 05:07:28
680,Industrias Castellana S.Com. Modificado,gruporamírezs.coop.@hotmail.com,2022-12-12 05:25:52,2025-12-27 05:07:28
687,Restauración Díez S.Coop. Modificado,infraestructurasescalonayasociadoss.com.@gmail.com,2021-05-24 15:38:48,2025-12-27 05:07:28
705,Infraestructuras KEX S.Com. Modificado,hnosbrioness.com.@hotmail.com,2020-03-31 15:37:18,2025-12-27 05:07:28
706,Soto y asociados S.A. Modificado,comercialcastellanas.coop.@outlook.com,2024-03-06 11:39:47,2025-12-27 05:07:28
721,Cuadrado y asociados S.L.U. Modificado,villanuevayasociadoss.com.@gmail.com,2020-06-22 05:24:07,2025-12-27 05:07:28
722,Haydée Lozano Sanz S.A.D Modificado,galvezyponss.coop.@hotmail.com,2023-08-16 13:11:17,2025-12-27 05:07:28
726,Alimentación Mendez y asociados S.L.L. Modificado,barros&asociadoss.l.@gmail.com,2022-09-04 12:56:28,2025-12-27 05:07:28
727,Industrias Pedro S.L.N.E Modificado,desarrollodellevantes.coop.@outlook.com,2020-10-24 01:02:42,2025-12-27 05:07:28
728,Gracia Ocaña Cañellas S.Com. Modificado,bernardobelmontehuertas.a.@hotmail.com,2022-08-11 12:26:21,2025-12-27 05:07:28
732,Instalaciones IE S.A. Modificado,juansantosripolls.l.@outlook.com,2021-10-14 08:31:45,2025-12-27 05:07:28
743,Morillo y asociados S.Coop. Modificado,nicolau&asociadoss.l.@outlook.com,2020-02-07 19:45:38,2025-12-27 05:07:28
747,Font & Asociados S.Coop. Modificado,suministroscorderos.a.@gmail.com,2020-03-11 09:32:04,2025-12-27 05:07:28
748,Rosa y asociados S.Coop. Modificado,consultoríainteligentess.l.l.@hotmail.com,2022-07-15 02:46:17,2025-12-27 05:07:28
749,Consultoría Mariscal y asociados S.L.L. Modificado,hermanosolmos.l.n.e@outlook.com,2020-06-01 15:10:52,2025-12-27 05:07:28
750,Ibáñez y asociados S.Coop. Modificado,joseramírezjaéns.com.@hotmail.com,2021-11-04 01:10:29,2025-12-27 05:07:28
774,Inversiones OQT S.A. Modificado,joseignaciodomínguezarocas.com.@outlook.com,2022-06-05 07:22:51,2025-12-27 05:07:28
792,Comercial KYVH S.L.N.E Modificado,industriaspinedas.com.@hotmail.com,2021-06-07 17:36:52,2025-12-27 05:07:28
806,Familia Páez S.Com. Modificado,alimentaciónmvhjs.coop.@hotmail.com,2020-09-10 22:01:11,2025-12-27 05:07:28
808,Industrias Olmedo S.L.N.E Modificado,anunciaciónvilahervias.coop.@hotmail.com,2020-01-16 12:36:03,2025-12-27 05:07:28
809,Borrego y Macías S.L.N.E Modificado,ruedaybellos.a.@outlook.com,2021-10-25 13:19:04,2025-12-27 05:07:28
816,Farmaceútica FC S.A. Modificado,pla&asociadoss.a.@gmail.com,2020-01-31 03:51:03,2025-12-27 05:07:28
819,Vargas y Huguet S.A.T. Modificado,hotelglobaless.com.@hotmail.com,2020-07-01 05:06:48,2025-12-27 05:07:28
833,Tecnologías Julián y asociados S.Coop. Modificado,industriasmontserrats.a.@hotmail.com,2023-11-28 20:15:10,2025-12-27 05:07:28
837,Comercial Integrales S.L. Modificado,desarrollocañellas&asociadoss.a.t.@gmail.com,2024-04-03 19:08:16,2025-12-27 05:07:28
840,Farmaceútica Ríos S.A. Modificado,grupotenas.coop.@hotmail.com,2022-05-10 05:15:14,2025-12-27 05:07:28
856,Logística Ibéricos S.L.L. Modificado,salcedoyruedas.l.@gmail.com,2021-09-01 17:08:31,2025-12-27 05:07:28
875,Hnos Garriga S.Coop. Modificado,industriasgalindos.l.@outlook.com,2021-01-14 08:22:05,2025-12-27 05:07:28
881,Consultoría Catalá & Asociados S.A. Modificado,maríamanuelaportillomontserrats.coop.@hotmail.com,2021-05-05 10:16:14,2025-12-27 05:07:28
888,Morales y asociados S.A. Modificado,jenarodomínguezferreros.a.@gmail.com,2021-05-04 18:05:09,2025-12-27 05:07:28
902,Supermercados Carmona S.Coop. Modificado,finanzasvergarayasociadoss.l.@gmail.com,2021-02-09 15:59:42,2025-12-27 05:07:28
911,Restauración Ríos S.L.N.E Modificado,alimentacióniriartes.a.d@outlook.com,2020-10-20 15:54:10,2025-12-27 05:07:28
922,Fábrica Integrales S.Coop. Modificado,mínguezymaldonados.l.u.@outlook.com,2023-10-13 19:51:49,2025-12-27 05:07:28
935,Fábrica Villalonga y asociados S.L. Modificado,solucionesdelnoroestes.com.@outlook.com,2022-07-23 16:34:25,2025-12-27 05:07:28
946,Farmaceútica Luís y asociados S.A. Modificado,transportesjls.coop.@outlook.com,2024-03-21 09:20:56,2025-12-27 05:07:28
947,Hnos Castell S.A. Modificado,quiroga&asociadoss.com.@gmail.com,2021-08-21 23:43:13,2025-12-27 05:07:28
984,Comercializadora Beltrán S.A. Modificado,fábricafernandez&asociadoss.coop.@outlook.com,2023-09-23 09:07:18,2025-12-27 05:07:28
989,Bárbara Hoyos Bolaños S.Coop. Modificado,distribucionesruanoyasociadoss.a.@hotmail.com,2023-03-19 18:24:16,2025-12-27 05:07:28
1002,Hnos Blázquez S.A. Modificado,alimentaciónuvcts.com.@hotmail.com,2022-11-25 06:29:10,2025-12-27 05:07:28
1011,Planas & Asociados S.Coop. Modificado,finanzaslldfs.l.n.e@hotmail.com,2020-08-10 22:34:33,2025-12-27 05:07:28
1024,Jennifer Capdevila Mateos S.Coop. Modificado,tecnologíasinternacionaless.a.@gmail.com,2022-05-24 15:21:09,2025-12-27 05:07:28
1035,Murillo y Alba S.A. Modificado,cayetanogoñitalaveras.coop.@gmail.com,2022-06-17 08:48:02,2025-12-27 05:07:28
1041,Marta Blanch Pina S.L.L. Modificado,hotelrmcs.a.@gmail.com,2022-03-25 02:58:41,2025-12-27 05:07:28
1046,Palacio & Asociados S.Coop. Modificado,pazcastejónzapatas.com.@hotmail.com,2024-11-13 00:21:00,2025-12-27 05:07:28
1068,Restauración Baena S.L.N.E Modificado,casares&asociadoss.coop.@gmail.com,2022-06-14 03:05:06,2025-12-27 05:07:28
1075,Familia Calvo S.L. Modificado,verdejoychecas.coop.@hotmail.com,2022-02-28 22:57:45,2025-12-27 05:07:28
1080,Riera y asociados S.L. Modificado,manufacturasdelmediterráneos.l.@gmail.com,2022-03-08 15:27:49,2025-12-27 05:07:28
1095,Alimentación Paniagua & Asociados S.L. Modificado,comercializadorabaenayasociadoss.com.@outlook.com,2021-01-07 21:30:42,2025-12-27 05:07:28
1101,Gonzalo y Bueno S.Com. Modificado,carroygisberts.a.@gmail.com,2022-09-12 03:36:32,2025-12-27 05:07:28
1125,Guardiola y Moya S.Com. Modificado,tallerestudelayasociadoss.l.l.@hotmail.com,2024-10-14 05:54:55,2025-12-27 05:07:28
1127,Banca Privada del Noroeste S.L. Modificado,domingomontserratmoless.l.l.@outlook.com,2022-04-24 01:18:37,2025-12-27 05:07:28
1136,Logística Española S.A. Modificado,hermanosguerras.a.@hotmail.com,2023-02-09 01:44:02,2025-12-27 05:07:28
1144,Tecnologías XKR S.L. Modificado,fannyrosalessolanos.com.@gmail.com,2022-01-28 11:59:56,2025-12-27 05:07:28
1156,Familia Zapata S.A. Modificado,comercializadoraromeros.coop.@hotmail.com,2022-05-13 06:05:08,2025-12-27 05:07:28
1164,Ochoa y asociados S.L. Modificado,perellóyasociadoss.l.n.e@gmail.com,2022-04-18 05:59:52,2025-12-27 05:07:28
1187,Sierra y asociados S.A. Modificado,bancaprivadaarmass.com.@gmail.com,2020-07-06 01:03:04,2025-12-27 05:07:28
1188,Hermanos Alcolea S.Coop. Modificado,salamancayvarelas.coop.@gmail.com,2020-09-08 15:45:33,2025-12-27 05:07:28
1193,Manufacturas NWGY S.A. Modificado,juanluisllobetcampss.com.@outlook.com,2021-04-19 09:33:17,2025-12-27 05:07:28
1211,Banco Sancho y asociados S.A. Modificado,farmaceúticaveras.l.@hotmail.com,2024-01-27 02:15:50,2025-12-27 05:07:28
1229,Inversiones Escamilla S.A.D Modificado,restauracióniberias.l.l.@gmail.com,2021-12-18 13:50:29,2025-12-27 05:07:28
1239,Alimentación Villar & Asociados S.Coop. Modificado,grupofalcóns.l.l.@hotmail.com,2021-07-09 07:51:02,2025-12-27 05:07:28
1242,Arnal & Asociados S.L. Modificado,familiaaramburus.a.t.@gmail.com,2020-04-18 21:27:14,2025-12-27 05:07:28
1244,Guardiola y Guillen S.Com. Modificado,grupoborrells.com.@outlook.com,2022-11-01 00:53:55,2025-12-27 05:07:28
1253,Lerma y asociados S.Coop. Modificado,álvaroyasociadoss.l.@outlook.com,2022-10-12 19:01:04,2025-12-27 05:07:28
1279,Godoy y Estrada S.Com. Modificado,danielapeinadoherreros.a.t.@outlook.com,2022-02-25 01:00:55,2025-12-27 05:07:28
1294,Llorente & Asociados S.Com. Modificado,hermanoscarrillos.com.@outlook.com,2023-08-01 00:43:19,2025-12-27 05:07:28
1305,Reyes y Morcillo S.A. Modificado,logísticablanch&asociadoss.l.@hotmail.com,2024-03-21 07:31:44,2025-12-27 05:07:28
1312,Comercializadora del Mediterráneo S.L. Modificado,girón&asociadoss.com.@gmail.com,2024-05-24 17:17:06,2025-12-27 05:07:28
1313,Hnos Luz S.Coop. Modificado,bernarditafalcócalvos.a.@hotmail.com,2021-05-19 11:08:03,2025-12-27 05:07:28
1338,Restauración del Levante S.A.U Modificado,hnoscallejas.l.@hotmail.com,2021-07-16 05:20:22,2025-12-27 05:07:28
1343,Exposito y asociados S.Coop. Modificado,instalacionesduartes.l.@hotmail.com,2021-02-06 07:48:48,2025-12-27 05:07:28
1352,Comercial Morante & Asociados S.L. Modificado,promocionescanos.a.@gmail.com,2023-05-18 21:34:18,2025-12-27 05:07:28
1375,Hnos Osorio S.Com. Modificado,logísticaperaless.l.n.e@outlook.com,2022-03-13 14:29:30,2025-12-27 05:07:28
1385,Morera y asociados S.L.N.E Modificado,quintanillayasociadoss.com.@hotmail.com,2023-07-29 02:31:07,2025-12-27 05:07:28
1393,Juan Bautista Blázquez Solsona S.L. Modificado,ribesyescuderos.coop.@gmail.com,2021-06-05 20:47:11,2025-12-27 05:07:28
1398,Calisto Lerma Puga S.C.P Modificado,suministroscabo&asociadoss.c.p@hotmail.com,2020-07-21 02:33:09,2025-12-27 05:07:28
1421,Parejo y Guerra S.L.L. Modificado,serrayasociadoss.coop.@outlook.com,2020-05-30 02:11:38,2025-12-27 05:07:28
1436,Despacho Española S.A. Modificado,serviciosdelnoroestes.l.n.e@gmail.com,2020-02-09 16:46:44,2025-12-27 05:07:28
1437,Comercial Collado y asociados S.C.P Modificado,sarmientoymerinos.l.@outlook.com,2021-01-19 09:39:58,2025-12-27 05:07:28
1442,Manufacturas Garzón & Asociados S.Com. Modificado,hnosseguís.a.@outlook.com,2022-01-01 06:23:51,2025-12-27 05:07:28
1443,Compañía UUT S.L.U. Modificado,despachohervásyasociadoss.l.n.e@gmail.com,2020-12-10 22:40:39,2025-12-27 05:07:28
1452,Molina & Asociados S.Coop. Modificado,supermercadosmacíass.coop.@outlook.com,2020-09-27 10:40:00,2025-12-27 05:07:28
1455,Servicios Globales S.L. Modificado,alimentacióndellevantes.com.@gmail.com,2021-06-17 21:53:59,2025-12-27 05:07:28
1459,Comercializadora Clavero & Asociados S.A. Modificado,maríamanuelasobrinogutierrezs.com.@gmail.com,2021-08-24 09:30:41,2025-12-27 05:07:28
1465,Consultoría NPUB S.L.N.E Modificado,villaybustoss.l.@hotmail.com,2022-11-08 10:10:45,2025-12-27 05:07:28
1477,Ema Marin Roman S.C.P Modificado,comercialtomáss.coop.@outlook.com,2020-11-17 11:32:35,2025-12-27 05:07:28
1499,Fábrica PQP S.A. Modificado,sevillanoyluques.coop.@outlook.com,2021-06-18 20:52:30,2025-12-27 05:07:28
1506,Finanzas Ibérica S.Com. Modificado,manufacturasbautistayasociadoss.c.p@outlook.com,2021-04-28 01:34:09,2025-12-27 05:07:28
1528,Construcción Gallart y asociados S.Coop. Modificado,artigasyquerols.l.@hotmail.com,2024-05-01 20:13:52,2025-12-27 05:07:28
1583,Banco del Mediterráneo S.A. Modificado,talleresmavs.com.@hotmail.com,2024-07-04 15:20:22,2025-12-27 05:07:28
1613,Murcia y Ayala S.Coop. Modificado,construcciónviana&asociadoss.l.@hotmail.com,2021-02-05 11:08:15,2025-12-27 05:07:28
1621,Hermanos Trujillo S.Com. Modificado,gayayasociadoss.c.p@outlook.com,2021-06-14 16:01:18,2025-12-27 05:07:28
1625,Hotel Castellana S.A. Modificado,supermercadosibéricoss.coop.@outlook.com,2022-02-16 10:29:03,2025-12-27 05:07:28
1643,Hermanos Cortés S.L.N.E Modificado,logísticadellevantes.coop.@hotmail.com,2022-02-06 13:26:28,2025-12-27 05:07:28
1652,Eduardo Carballo Verdugo S.L.N.E Modificado,comercialdelsurs.l.n.e@outlook.com,2023-01-04 15:24:27,2025-12-27 05:07:28
1663,Soler y Díez S.L.L. Modificado,tormo&asociadoss.c.p@hotmail.com,2022-08-25 10:23:49,2025-12-27 05:07:28
1693,Florencia Cepeda Pol S.L. Modificado,comercializadoramartins.l.n.e@outlook.com,2022-05-13 21:26:23,2025-12-27 05:07:28
1694,Celia Carbonell Cuenca S.L. Modificado,murciayasociadoss.coop.@hotmail.com,2020-08-08 18:21:12,2025-12-27 05:07:28
1696,Feliu y asociados S.Coop. Modificado,infraestructurasdelnoroestes.com.@gmail.com,2023-09-07 06:10:43,2025-12-27 05:07:28
1699,Sancho Colomer Gaya S.L.L. Modificado,serviciosibéricoss.com.@hotmail.com,2020-09-10 19:47:01,2025-12-27 05:07:28
1709,Hotel Martí & Asociados S.Com. Modificado,compañíafusters.com.@gmail.com,2022-03-14 18:28:40,2025-12-27 05:07:28
1723,Logística Internacionales S.Coop. Modificado,rosa&asociadoss.l.n.e@hotmail.com,2021-07-07 17:00:44,2025-12-27 05:07:28
1727,Tecnologías Integrales S.L. Modificado,pallarèsyboadas.coop.@outlook.com,2021-11-05 14:06:46,2025-12-27 05:07:28
1734,Gomis y Bermejo S.Coop. Modificado,mineríatéllezs.com.@gmail.com,2021-08-08 09:46:40,2025-12-27 05:07:28
1763,Restauración Ortega y asociados S.L.U. Modificado,gallo&asociadoss.com.@gmail.com,2022-04-01 06:40:00,2025-12-27 05:07:28
1780,Desarrollo Ortega S.L.L. Modificado,promocionesfalcónyasociadoss.coop.@hotmail.com,2024-05-21 20:53:50,2025-12-27 05:07:28
1783,Minería del Sur S.L.N.E Modificado,serviciosmrfs.coop.@gmail.com,2021-02-24 15:18:13,2025-12-27 05:07:28
1795,Nicanor Cantón Ochoa S.L.L. Modificado,doménechyferrándezs.l.@hotmail.com,2020-01-09 09:19:24,2025-12-27 05:07:28
1801,Hermanos Baena S.L. Modificado,sastreyureñas.l.n.e@outlook.com,2024-03-11 18:10:33,2025-12-27 05:07:28
1811,Comercial Valcárcel y asociados S.L.N.E Modificado,hnosgonzálezs.com.@hotmail.com,2022-06-29 06:22:58,2025-12-27 05:07:28
1813,Hotel Ibéricos S.Coop. Modificado,tecnologíasintegraless.a.t.@hotmail.com,2020-05-23 11:05:38,2025-12-27 05:07:28
1815,Zabala & Asociados S.Coop. Modificado,inversionesdelmediterráneos.com.@outlook.com,2023-06-30 20:26:58,2025-12-27 05:07:28
1821,Banca Privada Avanzadas S.L. Modificado,comercializadorarobles&asociadoss.a.t.@hotmail.com,2020-09-13 01:25:24,2025-12-27 05:07:28
1843,Distribuciones Rivera S.Com. Modificado,serviciosinteligentess.l.u.@outlook.com,2021-11-01 13:51:13,2025-12-27 05:07:28
1846,Abilio Narváez Campo S.L. Modificado,emiliagarciafonsecas.l.n.e@hotmail.com,2021-07-02 22:45:57,2025-12-27 05:07:28
1848,Gelabert y asociados S.C.P Modificado,comercializadoralarrañagas.l.@hotmail.com,2021-04-25 04:58:14,2025-12-27 05:07:28
1850,Promociones NG S.L.L. Modificado,josefinasedanoandréss.a.@gmail.com,2023-05-18 10:47:04,2025-12-27 05:07:28
1861,Familia Noriega S.Coop. Modificado,óscarramosmuros.com.@outlook.com,2023-11-14 19:49:38,2025-12-27 05:07:28
1862,Hermanos Benitez S.L.N.E Modificado,ponceymirós.coop.@outlook.com,2021-01-10 18:07:38,2025-12-27 05:07:28
1867,Comercializadora Duque & Asociados S.Com. Modificado,gruporománs.l.n.e@hotmail.com,2024-03-02 22:42:05,2025-12-27 05:07:28
1878,María Ángeles Sáez Cepeda S.L.U. Modificado,guardiaybayonas.a.@hotmail.com,2020-10-21 15:00:55,2025-12-27 05:07:28
1882,Banco Capdevila & Asociados S.Com. Modificado,anselmabecerrabeltráns.coop.@outlook.com,2022-12-07 10:44:48,2025-12-27 05:07:28
1885,Transportes Carlos y asociados S.A.T. Modificado,industriasdxgs.com.@hotmail.com,2022-01-31 16:23:21,2025-12-27 05:07:28
1898,Inversiones Quesada S.A. Modificado,despachoecs.l.@outlook.com,2021-06-06 01:57:36,2025-12-27 05:07:28
1899,Aranda y Verdú S.A.T. Modificado,hnostamayos.com.@outlook.com,2021-06-15 13:37:16,2025-12-27 05:07:28
1904,Banco FN S.Com. Modificado,desarrollodelnortes.coop.@outlook.com,2021-04-05 05:09:46,2025-12-27 05:07:28
1905,Hermanos Bayón S.Com. Modificado,compañíaacostas.a.@gmail.com,2020-06-17 03:49:43,2025-12-27 05:07:28
1914,Gracia Ariza Folch S.Com. Modificado,hermanosamoróss.a.@hotmail.com,2024-07-29 22:42:52,2025-12-27 05:07:28
1924,Logística Ibérica S.Coop. Modificado,hoteloss.coop.@hotmail.com,2021-02-17 19:04:05,2025-12-27 05:07:28
1925,Minería Gutierrez S.Com. Modificado,inversionescomas&asociadoss.a.@hotmail.com,2020-01-03 18:54:30,2025-12-27 05:07:28
1938,Fábrica Globales S.A. Modificado,vidalyasociadoss.com.@gmail.com,2024-07-04 09:48:19,2025-12-27 05:07:28
1950,Banco Integrales S.L.U. Modificado,sacristányfiols.l.@outlook.com,2023-11-11 08:44:45,2025-12-27 05:07:28
1952,Soluciones Avanzadas S.L. Modificado,arizayecheverrías.a.@gmail.com,2024-11-23 11:24:13,2025-12-27 05:07:28
1983,Banco Inteligentes S.L.L. Modificado,grupobernals.a.@outlook.com,2022-03-06 08:34:33,2025-12-27 05:07:28
1987,Familia Chacón S.Com. Modificado,lamasyasociadoss.l.@hotmail.com,2020-10-25 08:39:08,2025-12-27 05:07:28
1990,Logística Españolas S.Coop. Modificado,finanzasdelmediterráneos.l.n.e@gmail.com,2023-06-26 19:40:34,2025-12-27 05:07:28
1991,Héctor Requena Manso S.C.P Modificado,mateyfalcós.l.l.@outlook.com,2022-04-25 14:10:58,2025-12-27 05:07:28
1998,Elorza y asociados S.L.N.E Modificado,font&asociadoss.com.@hotmail.com,2020-03-27 23:23:42,2025-12-27 05:07:28
2003,Fajardo y asociados S.Coop. Modificado,gruposegarras.l.@hotmail.com,2022-08-23 09:36:33,2025-12-27 05:07:28
2022,Soluciones Palmer & Asociados S.L.U. Modificado,oliverypolos.l.u.@outlook.com,2024-02-15 14:44:28,2025-12-27 05:07:28
2032,Hnos Pol S.A. Modificado,familiabayóns.a.@outlook.com,2020-09-17 07:14:11,2025-12-27 05:07:28
2045,Inmobiliaria Estévez S.A. Modificado,finanzasums.l.@gmail.com,2022-05-06 12:41:42,2025-12-27 05:07:28
2046,Primitivo Salmerón Puente S.L. Modificado,supermercadosjódaryasociadoss.coop.@hotmail.com,2022-05-14 19:52:35,2025-12-27 05:07:28
2066,Jeremías Flor Carrasco S.C.P Modificado,jove&asociadoss.l.@outlook.com,2021-12-03 00:30:10,2025-12-27 05:07:28
2084,Consultoría Castellana S.A.U Modificado,mateuyroldáns.coop.@hotmail.com,2020-09-01 05:41:06,2025-12-27 05:07:28
