account_id,account_name,email,created_at,updated_at
2086,Comercializadora Contreras S.L.L. Modificado,familiajuliás.l.n.e@outlook.com,2023-06-29 09:22:18,2025-12-27 05:07:28
2087,Promociones del Noroeste S.L.L. Modificado,finanzastumbs.l.@outlook.com,2022-05-27 14:43:51,2025-12-27 05:07:28
2101,Pintor & Asociados S.L.N.E Modificado,inmobiliariatlxs.l.@gmail.com,2024-12-22 00:14:09,2025-12-27 05:07:28
2107,Inmobiliaria del Norte S.A.D Modificado,realybravos.com.@outlook.com,2024-04-17 16:10:46,2025-12-27 05:07:28
2118,Abellán y Álamo S.Com. Modificado,distribucionesborrells.a.@gmail.com,2024-07-09 08:52:44,2025-12-27 05:07:28
2144,Construcción VEBH S.Com. Modificado,transportesrhs.coop.@hotmail.com,2021-03-14 11:51:11,2025-12-27 05:07:28
2156,Construcción GX S.Com. Modificado,lopez&asociadoss.coop.@gmail.com,2020-12-29 09:02:49,2025-12-27 05:07:28
2157,Industrias Borrás y asociados S.Coop. Modificado,industriasmys.l.n.e@gmail.com,2021-04-11 13:40:59,2025-12-27 05:07:28
2175,Lina Diez Llamas S.Com. Modificado,durán&asociadoss.l.@gmail.com,2022-09-12 02:28:58,2025-12-27 05:07:28
2178,Fábrica DV S.Coop. Modificado,inmobiliariagrau&asociadoss.l.u.@gmail.com,2021-10-10 13:09:09,2025-12-27 05:07:28
2183,Distribuciones TT S.Com. Modificado,tomásolivasantiagos.l.n.e@outlook.com,2022-12-28 03:12:28,2025-12-27 05:07:28
2191,Consultoría del Levante S.L. Modificado,pacheco&asociadoss.l.@hotmail.com,2020-10-20 08:54:39,2025-12-27 05:07:28
2193,Arellano y Verdú S.L. Modificado,hotelolivares&asociadoss.com.@gmail.com,2023-01-31 16:59:59,2025-12-27 05:07:28
2200,Minería Española S.A. Modificado,adalbertoplacarreras.c.p@outlook.com,2023-02-13 14:16:31,2025-12-27 05:07:28
2219,Hotel Vall S.L. Modificado,zaragozayasociadoss.l.@gmail.com,2021-01-29 16:31:22,2025-12-27 05:07:28
2221,Hermanos Lasa S.Coop. Modificado,supermercadosors.a.@outlook.com,2023-05-16 12:11:06,2025-12-27 05:07:28
2245,Inversiones Inteligentes S.A. Modificado,manufacturascarrións.l.@hotmail.com,2021-01-29 09:44:06,2025-12-27 05:07:28
2260,Herranz y Perales S.A.U Modificado,comercialhozs.a.u@hotmail.com,2023-10-03 06:42:08,2025-12-27 05:07:28
2274,Supermercados Tormo y asociados S.Com. Modificado,español&asociadoss.coop.@gmail.com,2022-06-13 23:34:28,2025-12-27 05:07:28
2288,Lumbreras & Asociados S.L.N.E Modificado,comercialintegraless.l.l.@hotmail.com,2023-09-28 15:15:49,2025-12-27 05:07:28
2292,Familia Barragán S.Coop. Modificado,inversionesmds.c.p@hotmail.com,2023-11-29 09:53:00,2025-12-27 05:07:28
2321,Banco Mateos y asociados S.Coop. Modificado,seguíyasociadoss.coop.@outlook.com,2021-04-11 02:50:36,2025-12-27 05:07:28
2373,Consultoría Españolas S.Com. Modificado,supermercadosmariño&asociadoss.l.l.@gmail.com,2022-03-31 21:33:09,2025-12-27 05:07:28
2378,Consuela Segovia Bilbao S.A. Modificado,leónycaparróss.l.@outlook.com,2024-04-29 00:34:59,2025-12-27 05:07:28
2391,Fernández y Casals S.L.N.E Modificado,fábricasobrino&asociadoss.a.@hotmail.com,2023-12-19 20:54:45,2025-12-27 05:07:28
2396,José Pedraza Tello S.Com. Modificado,manufacturasmateos.l.l.@hotmail.com,2021-10-24 21:21:34,2025-12-27 05:07:28
2410,Transportes Gargallo & Asociados S.Coop. Modificado,tecnologíasleón&asociadoss.a.@gmail.com,2023-03-15 04:42:39,2025-12-27 05:07:28
2438,Bustamante & Asociados S.A. Modificado,uribeypriegos.coop.@hotmail.com,2020-04-05 23:19:26,2025-12-27 05:07:28
2439,Banca Privada del Levante S.L.N.E Modificado,desarrollodelnoroestes.l.n.e@hotmail.com,2022-06-17 01:23:54,2025-12-27 05:07:28
2445,Restauración Villalonga y asociados S.A. Modificado,tecnologíasxts.coop.@hotmail.com,2022-10-25 16:33:54,2025-12-27 05:07:28
2471,Ochoa y Villalonga S.Com. Modificado,cerdáysalvàs.a.@outlook.com,2021-02-20 06:26:00,2025-12-27 05:07:28
2482,Banca Privada ED S.Coop. Modificado,familiaalegres.l.@gmail.com,2024-02-18 20:19:50,2025-12-27 05:07:28
2495,Valdés y asociados S.Coop. Modificado,bancoavanzadass.a.@gmail.com,2022-11-14 17:46:20,2025-12-27 05:07:28
2531,Minería Anguita & Asociados S.Coop. Modificado,hotelibéricas.com.@gmail.com,2021-06-16 14:21:47,2025-12-27 05:07:28
2536,Ana Belén Naranjo Cuesta S.A. Modificado,grupobatlles.l.@gmail.com,2024-07-02 08:28:01,2025-12-27 05:07:28
2542,Muro y asociados S.Com. Modificado,márquezyortizs.l.n.e@outlook.com,2024-03-29 19:12:36,2025-12-27 05:07:28
2552,Banco Poza S.L. Modificado,hnosmateos.l.@hotmail.com,2022-02-21 23:24:27,2025-12-27 05:07:28
2556,Servicios DKJU S.A. Modificado,familiasastres.l.@hotmail.com,2023-01-23 04:45:39,2025-12-27 05:07:28
2559,Serafina Antúnez Carlos S.Com. Modificado,morerayasociadoss.l.@gmail.com,2023-04-24 11:47:45,2025-12-27 05:07:28
2566,Carreño y Plana S.Coop. Modificado,supermercadoshis.a.@hotmail.com,2020-08-14 19:52:49,2025-12-27 05:07:28
2575,Alimentación HJF S.Coop. Modificado,hotelcds.a.@hotmail.com,2020-07-07 19:07:01,2025-12-27 05:07:28
2579,Hnos Campillo S.A. Modificado,comercializadorallopis&asociadoss.com.@gmail.com,2024-12-11 18:16:52,2025-12-27 05:07:28
2580,Comercial Gomila S.Com. Modificado,inmobiliariaajhis.com.@hotmail.com,2021-03-02 07:43:58,2025-12-27 05:07:28
2590,Canales y asociados S.Com. Modificado,industriascepedas.a.u@hotmail.com,2021-04-27 04:10:29,2025-12-27 05:07:28
2591,Ema Arregui Guzman S.A. Modificado,pazyasociadoss.coop.@gmail.com,2021-08-03 03:25:49,2025-12-27 05:07:28
2595,Muro y Teruel S.L. Modificado,suministroscabreros.l.n.e@outlook.com,2023-05-19 00:02:08,2025-12-27 05:07:28
2599,Samper y Atienza S.L.N.E Modificado,despachoarizas.a.t.@gmail.com,2020-11-16 09:39:21,2025-12-27 05:07:28
2603,Zamora y Carbó S.A. Modificado,bancomorenos.coop.@gmail.com,2021-03-03 01:06:09,2025-12-27 05:07:28
2615,Finanzas Bilbao S.Com. Modificado,bancaprivadarobles&asociadoss.com.@outlook.com,2020-09-10 06:09:42,2025-12-27 05:07:28
2618,Suministros IAAB S.Coop. Modificado,inmobiliariagallardo&asociadoss.a.@outlook.com,2021-07-20 10:22:53,2025-12-27 05:07:28
2624,Mur y asociados S.L. Modificado,bancohervia&asociadoss.a.@outlook.com,2023-03-08 16:56:21,2025-12-27 05:07:28
2634,Batlle y Valdés S.A. Modificado,palma&asociadoss.coop.@gmail.com,2024-03-19 07:26:29,2025-12-27 05:07:28
2639,Hnos Porta S.L. Modificado,distribucionesespañolas.l.l.@outlook.com,2024-03-16 07:03:09,2025-12-27 05:07:28
2653,Comercial del Mediterráneo S.Com. Modificado,familiagómezs.coop.@outlook.com,2023-11-12 22:22:51,2025-12-27 05:07:28
2655,Finanzas Vilaplana & Asociados S.L.N.E Modificado,llorensyasociadoss.com.@gmail.com,2020-12-01 16:24:15,2025-12-27 05:07:28
2661,Manufacturas Castellana S.L.L. Modificado,grupoalcarazs.c.p@gmail.com,2021-07-08 12:04:38,2025-12-27 05:07:28
2670,Múgica y asociados S.A.D Modificado,familiatomés.l.@outlook.com,2024-11-16 22:53:40,2025-12-27 05:07:28
2679,Servicios del Norte S.A. Modificado,mineríaespañolass.l.l.@outlook.com,2020-11-14 19:58:38,2025-12-27 05:07:28
2684,Gallardo y asociados S.A. Modificado,gruporobledos.c.p@hotmail.com,2024-09-27 19:37:17,2025-12-27 05:07:28
2695,Flor y Roldán S.L.L. Modificado,bancaprivadadellevantes.coop.@hotmail.com,2020-07-14 18:46:15,2025-12-27 05:07:28
2702,Pol y Ferrándiz S.C.P Modificado,solucionesnarváezs.l.n.e@hotmail.com,2024-10-02 02:08:19,2025-12-27 05:07:28
2703,Comercial Fabregat S.L.N.E Modificado,desarrollomontañas.com.@hotmail.com,2020-10-04 23:52:24,2025-12-27 05:07:28
2708,Hnos Bravo S.Com. Modificado,susanamonteromuñozs.a.@gmail.com,2023-05-04 10:15:09,2025-12-27 05:07:28
2709,Hermanos Corral S.Coop. Modificado,hnosrozass.l.l.@hotmail.com,2021-10-21 19:59:55,2025-12-27 05:07:28
2713,Adelina Checa Guitart S.A. Modificado,supermercadosamayayasociadoss.com.@outlook.com,2023-03-06 06:01:33,2025-12-27 05:07:28
2714,Consultoría LO S.L. Modificado,hilarioespañolalarcóns.l.@hotmail.com,2022-01-23 09:07:25,2025-12-27 05:07:28
2727,Bárcena y asociados S.L. Modificado,farmaceúticaxqeis.coop.@hotmail.com,2020-05-24 16:13:59,2025-12-27 05:07:28
2735,Virgilio Duque Pazos S.L. Modificado,telloyasociadoss.l.@hotmail.com,2021-08-15 04:43:53,2025-12-27 05:07:28
2749,Farmaceútica Perales & Asociados S.Coop. Modificado,solucionespys.coop.@outlook.com,2023-02-04 13:28:23,2025-12-27 05:07:28
2765,Hnos Toledo S.L. Modificado,hermanosfalcós.l.n.e@gmail.com,2024-12-08 19:26:39,2025-12-27 05:07:28
2774,Banco Sierra S.A.U Modificado,alimentaciónibéricoss.l.n.e@outlook.com,2021-01-07 06:44:27,2025-12-27 05:07:28
2780,Correa & Asociados S.A. Modificado,hotelduarte&asociadoss.l.@hotmail.com,2022-06-26 13:21:49,2025-12-27 05:07:28
2805,Farmaceútica Valdés & Asociados S.Com. Modificado,infraestructuraslermas.l.@hotmail.com,2021-01-13 16:15:38,2025-12-27 05:07:28
2807,María José Sarmiento Piñol S.A. Modificado,franco&asociadoss.com.@outlook.com,2024-08-02 22:25:28,2025-12-27 05:07:28
2818,Distribuciones Vidal y asociados S.A. Modificado,tudelayiniestas.coop.@hotmail.com,2024-10-29 17:01:01,2025-12-27 05:07:28
2819,Goyo Agustí Guillen S.L. Modificado,sorayajuanleóns.a.@hotmail.com,2022-12-17 16:30:27,2025-12-27 05:07:28
2861,Farmaceútica Guillén S.Com. Modificado,despachogarcías.l.@outlook.com,2020-04-12 04:32:12,2025-12-27 05:07:28
2867,Supermercados UG S.Coop. Modificado,industriasespañolas.l.@outlook.com,2022-07-13 19:16:53,2025-12-27 05:07:28
2882,Tecnologías Ibéricos S.Coop. Modificado,infraestructurasllorente&asociadoss.a.@outlook.com,2022-05-12 15:54:51,2025-12-27 05:07:28
2885,Inversiones del Levante S.Coop. Modificado,clementinaacostarocas.com.@gmail.com,2022-06-01 18:51:58,2025-12-27 05:07:28
2887,Acero & Asociados S.L.N.E Modificado,elodiagomilaguerreros.com.@hotmail.com,2023-12-15 08:34:42,2025-12-27 05:07:28
2889,Godofredo Izquierdo Saavedra S.Com. Modificado,bancaprivadabarrancoyasociadoss.l.n.e@hotmail.com,2020-03-31 03:17:17,2025-12-27 05:07:28
2932,Industrias Amo y asociados S.L. Modificado,verdejoynúñezs.l.@hotmail.com,2022-09-28 00:53:16,2025-12-27 05:07:28
2933,Tecnologías XB S.L. Modificado,sorayaguillenmiralless.a.@outlook.com,2021-11-03 19:09:18,2025-12-27 05:07:28
2935,Inmobiliaria RKJ S.A. Modificado,chico&asociadoss.l.l.@gmail.com,2024-04-24 01:28:33,2025-12-27 05:07:28
2943,Desarrollo WP S.L. Modificado,ascensiónhernándezabascals.coop.@gmail.com,2024-10-01 21:09:23,2025-12-27 05:07:28
2955,Alimentación Lorenzo S.A. Modificado,melisacózarpelayos.l.n.e@hotmail.com,2020-03-22 09:19:14,2025-12-27 05:07:28
2961,Pinto y asociados S.L.N.E Modificado,construccióngutierrezs.com.@gmail.com,2024-06-02 02:49:28,2025-12-27 05:07:28
2965,Hermanos Espejo S.C.P Modificado,sernayasociadoss.com.@hotmail.com,2022-03-14 06:19:21,2025-12-27 05:07:28
3006,Cayetana Cañizares Vives S.L. Modificado,desarrolloescalonas.a.@hotmail.com,2022-10-23 21:32:14,2025-12-27 05:07:28
3007,Cuesta y Sáenz S.L.U. Modificado,villenayasociadoss.l.n.e@outlook.com,2024-09-27 18:32:15,2025-12-27 05:07:28
3050,Soluciones Ortuño & Asociados S.Coop. Modificado,mineríameleroyasociadoss.com.@gmail.com,2022-06-10 03:13:48,2025-12-27 05:07:28
3052,Instalaciones Inteligentes S.Coop. Modificado,grupomercaders.a.@hotmail.com,2020-05-13 12:06:29,2025-12-27 05:07:28
3057,Construcción Integrales S.A. Modificado,villaryasociadoss.l.n.e@gmail.com,2022-08-07 14:19:29,2025-12-27 05:07:28
3064,Casanovas y Paredes S.Com. Modificado,construcciónglobaless.coop.@outlook.com,2024-03-15 18:46:23,2025-12-27 05:07:28
3081,Servicios QAXX S.Com. Modificado,sanchojimenezcervantess.l.@outlook.com,2021-04-10 13:07:39,2025-12-27 05:07:28
3089,Ferrández & Asociados S.L. Modificado,promocionesbenet&asociadoss.l.@gmail.com,2021-09-14 22:23:54,2025-12-27 05:07:28
3093,Cerdá y Álvaro S.Coop. Modificado,farmaceúticamartínez&asociadoss.com.@gmail.com,2023-08-20 20:07:53,2025-12-27 05:07:28
3098,Melania Garrido Campoy S.Com. Modificado,comercializadoradelnoroestes.coop.@hotmail.com,2022-08-25 10:16:25,2025-12-27 05:07:28
3117,Suministros OIE S.Com. Modificado,inmobiliariaintegraless.a.@hotmail.com,2022-11-20 12:22:51,2025-12-27 05:07:28
3120,Desarrollo Inteligentes S.L. Modificado,finanzascanoyasociadoss.l.n.e@gmail.com,2022-01-27 07:26:35,2025-12-27 05:07:28
3151,Farmaceútica TN S.A. Modificado,suministrosduartes.coop.@hotmail.com,2021-12-08 17:42:20,2025-12-27 05:07:28
3155,Distribuciones Cortes & Asociados S.A. Modificado,cuetoyasociadoss.com.@outlook.com,2024-02-27 04:03:19,2025-12-27 05:07:28
3159,Rivas y Piñol S.Com. Modificado,servicioscrs.l.n.e@hotmail.com,2022-02-07 16:15:44,2025-12-27 05:07:28
3164,Grupo Salas S.L. Modificado,cervera&asociadoss.l.n.e@outlook.com,2023-02-06 09:47:48,2025-12-27 05:07:28
3165,Tecnologías Aguado & Asociados S.Com. Modificado,molinayochoas.com.@outlook.com,2020-10-19 00:49:09,2025-12-27 05:07:28
3196,Comercializadora Salvador y asociados S.C.P Modificado,farmaceúticaibéricas.com.@gmail.com,2022-08-16 08:36:27,2025-12-27 05:07:28
3199,Finanzas Bonilla S.L.N.E Modificado,comercializadoraarnals.a.@outlook.com,2022-02-08 06:44:43,2025-12-27 05:07:28
3208,Transportes Atienza y asociados S.L. Modificado,bancaprivadasarabias.l.@hotmail.com,2023-04-14 01:56:14,2025-12-27 05:07:28
3230,Distribuciones del Mediterráneo S.A. Modificado,escamillayortizs.a.@hotmail.com,2023-10-06 19:17:30,2025-12-27 05:07:28
3233,Banca Privada GI S.Coop. Modificado,manufacturasvallsyasociadoss.com.@outlook.com,2020-04-20 06:32:13,2025-12-27 05:07:28
3236,Hnos Becerra S.Coop. Modificado,inversionesmarinyasociadoss.com.@hotmail.com,2020-01-28 05:49:14,2025-12-27 05:07:28
3240,Servicios del Sur S.L. Modificado,estévez&asociadoss.com.@gmail.com,2021-05-20 13:23:03,2025-12-27 05:07:28
3241,Zaragoza y Gordillo S.Com. Modificado,inmobiliariaespañolas.l.@gmail.com,2022-10-07 14:44:05,2025-12-27 05:07:28
3242,Santiago y Bárcena S.L. Modificado,valcárcel&asociadoss.com.@outlook.com,2020-10-30 06:38:14,2025-12-27 05:07:28
3249,Pera y asociados S.A. Modificado,uríayasociadoss.com.@gmail.com,2021-10-29 16:32:58,2025-12-27 05:07:28
3263,Logística Iberia S.A. Modificado,finanzascerezo&asociadoss.c.p@outlook.com,2020-10-01 13:53:12,2025-12-27 05:07:28
3266,Suministros Valencia & Asociados S.L. Modificado,abellányaliagas.c.p@gmail.com,2020-06-24 09:41:07,2025-12-27 05:07:28
3277,Transportes Guillen S.Coop. Modificado,supermercadosreyyasociadoss.l.@hotmail.com,2024-06-22 21:28:43,2025-12-27 05:07:28
3279,Restauración Galván S.Coop. Modificado,porcelyllamass.com.@outlook.com,2024-07-16 20:49:24,2025-12-27 05:07:28
3286,Hermanos Duarte S.L. Modificado,lledóyasociadoss.l.@hotmail.com,2022-02-15 05:36:42,2025-12-27 05:07:28
3294,Sevilla y Osorio S.A.U Modificado,familiavigils.a.u@gmail.com,2021-10-26 14:06:35,2025-12-27 05:07:28
3308,Tecnologías AXB S.Coop. Modificado,catalán&asociadoss.com.@outlook.com,2024-12-02 15:54:44,2025-12-27 05:07:28
3310,Familia Peral S.L. Modificado,industriasespañolas.a.@outlook.com,2023-02-03 03:41:39,2025-12-27 05:07:28
3319,Construcción Inteligentes S.Com. Modificado,farmaceúticadxls.l.@outlook.com,2021-04-19 01:30:35,2025-12-27 05:07:28
3335,Cerro y asociados S.A. Modificado,hermanossantoss.l.l.@outlook.com,2021-10-11 11:02:35,2025-12-27 05:07:28
3339,Restauración MDS S.L. Modificado,alimentaciónchamorros.c.p@hotmail.com,2020-05-04 21:22:29,2025-12-27 05:07:28
3343,Construcción Ortiz S.Coop. Modificado,pareja&asociadoss.l.@hotmail.com,2021-01-09 14:41:07,2025-12-27 05:07:28
3356,Samper & Asociados S.L.N.E Modificado,moratayasociadoss.a.@gmail.com,2021-12-05 08:00:53,2025-12-27 05:07:28
3357,Comercial IZAC S.C.P Modificado,elpidioballestercarballos.l.@hotmail.com,2020-11-24 05:53:36,2025-12-27 05:07:28
3358,Fábrica del Mediterráneo S.Coop. Modificado,curroricomontesinoss.coop.@gmail.com,2022-05-17 09:51:45,2025-12-27 05:07:28
3386,Hotel Torres S.Coop. Modificado,mineríadelnortes.l.n.e@outlook.com,2020-10-14 01:00:26,2025-12-27 05:07:28
3389,Catalá y Pinedo S.A. Modificado,téllez&asociadoss.com.@gmail.com,2021-07-09 11:58:54,2025-12-27 05:07:28
3408,Comercial Manso S.A. Modificado,promocionesabellayasociadoss.coop.@outlook.com,2023-07-08 13:28:08,2025-12-27 05:07:28
3440,Prats y asociados S.C.P Modificado,inmobiliariallamass.com.@gmail.com,2021-02-26 17:40:13,2025-12-27 05:07:28
3450,Hermanos Palomo S.Com. Modificado,aureliobartoloméiglesias.l.l.@gmail.com,2022-07-21 03:49:43,2025-12-27 05:07:28
3482,Navarrete & Asociados S.A. Modificado,ramóngarciaallers.a.@gmail.com,2021-07-20 12:17:32,2025-12-27 05:07:28
3483,Comercializadora Española S.C.P Modificado,alemanyybellos.coop.@hotmail.com,2020-11-04 03:33:59,2025-12-27 05:07:28
3488,Hnos Milla S.Coop. Modificado,distribucionescastellanas.l.n.e@outlook.com,2024-01-17 21:03:22,2025-12-27 05:07:28
3493,Manufacturas Canales S.L. Modificado,tecnologíasibéricas.l.@hotmail.com,2020-06-22 09:39:05,2025-12-27 05:07:28
3496,Jover y asociados S.L.U. Modificado,alimentaciónroldányasociadoss.c.p@gmail.com,2021-06-05 22:20:26,2025-12-27 05:07:28
3510,Manufacturas Soler S.Com. Modificado,serviciosrjjhs.l.u.@outlook.com,2020-01-06 20:33:26,2025-12-27 05:07:28
3515,Juan Francisco Pi Valle S.A. Modificado,suministrosinteligentess.l.@gmail.com,2022-09-22 01:52:06,2025-12-27 05:07:28
3519,Rosalinda Neira Torrents S.Com. Modificado,rodrigoyasociadoss.l.@gmail.com,2020-02-05 16:50:47,2025-12-27 05:07:28
3525,Ciríaco Barón Riba S.L. Modificado,alimentaciónips.a.@gmail.com,2022-01-27 20:38:58,2025-12-27 05:07:28
3530,Cerezo y asociados S.L.U. Modificado,grupoarévalos.coop.@gmail.com,2021-03-16 13:34:14,2025-12-27 05:07:28
3543,Pombo y Ríos S.L. Modificado,transportesuxjzs.coop.@outlook.com,2023-06-30 07:06:47,2025-12-27 05:07:28
3544,Girón y asociados S.A. Modificado,bancaprivadamartinyasociadoss.l.@gmail.com,2023-06-12 21:34:46,2025-12-27 05:07:28
3555,García y Moles S.Com. Modificado,miryburgoss.a.@gmail.com,2022-07-20 19:54:40,2025-12-27 05:07:28
3557,Herranz y Domínguez S.Coop. Modificado,lamas&asociadoss.l.u.@hotmail.com,2022-03-31 12:31:15,2025-12-27 05:07:28
3567,Construcción NITE S.Coop. Modificado,comercialats.com.@gmail.com,2024-02-19 05:59:48,2025-12-27 05:07:28
3572,Infraestructuras Murillo & Asociados S.L.N.E Modificado,suministrosmdgos.l.@outlook.com,2023-11-29 14:42:52,2025-12-27 05:07:28
3589,Desarrollo JP S.L.N.E Modificado,distribucionespxs.l.n.e@gmail.com,2021-05-02 00:52:56,2025-12-27 05:07:28
3599,Comercializadora Galvez S.A. Modificado,verdejo&asociadoss.a.@gmail.com,2021-12-08 00:34:26,2025-12-27 05:07:28
3614,Transportes Rivas y asociados S.A. Modificado,julián&asociadoss.com.@hotmail.com,2024-01-24 17:03:51,2025-12-27 05:07:28
3621,Hermanos Cuervo S.L. Modificado,supermercadoszapatayasociadoss.l.u.@outlook.com,2023-12-10 07:26:46,2025-12-27 05:07:28
3632,Marta Milla Barceló S.L. Modificado,tapiayasociadoss.l.n.e@hotmail.com,2021-12-16 08:29:41,2025-12-27 05:07:28
3633,Comercial del Levante S.A. Modificado,valenciayasociadoss.coop.@hotmail.com,2022-03-23 09:42:42,2025-12-27 05:07:28
3637,Hotel Vilaplana S.Com. Modificado,collado&asociadoss.l.n.e@hotmail.com,2022-09-02 13:54:56,2025-12-27 05:07:28
3641,Hnos Galan S.A.T. Modificado,hermanosmontess.a.@hotmail.com,2021-09-10 23:00:08,2025-12-27 05:07:28
3669,Alimentación XW S.A. Modificado,inmobiliariaibéricoss.a.d@hotmail.com,2023-04-07 06:49:05,2025-12-27 05:07:28
3672,Manufacturas Santamaría & Asociados S.A. Modificado,benaventybarberos.c.p@hotmail.com,2022-12-10 23:33:24,2025-12-27 05:07:28
3683,Comercial Pascual S.L. Modificado,bermudez&asociadoss.c.p@hotmail.com,2020-05-01 22:01:20,2025-12-27 05:07:28
3693,Farmaceútica Bejarano & Asociados S.L. Modificado,infraestructurasqts.coop.@outlook.com,2021-05-23 11:59:32,2025-12-27 05:07:28
3723,Acuña y asociados S.Coop. Modificado,grupotejadas.coop.@hotmail.com,2020-09-28 00:18:50,2025-12-27 05:07:28
3728,Sanchez y Vazquez S.L. Modificado,gomisyquirogas.a.@gmail.com,2023-08-21 06:20:12,2025-12-27 05:07:28
3748,Hotel NCQ S.Com. Modificado,luzycruzs.a.@gmail.com,2023-12-06 14:26:10,2025-12-27 05:07:28
3751,Infraestructuras Manuel y asociados S.L. Modificado,girona&asociadoss.a.u@hotmail.com,2024-07-23 21:15:30,2025-12-27 05:07:28
3768,Logística Castellana S.A.D Modificado,fábricaguzmáns.com.@hotmail.com,2023-03-26 14:55:13,2025-12-27 05:07:28
3772,Mesa y Catalán S.L. Modificado,pazyasociadoss.l.n.e@hotmail.com,2024-02-18 21:14:01,2025-12-27 05:07:28
3783,Fábrica Ferrera S.Coop. Modificado,asdruballarreahernándezs.l.u.@hotmail.com,2024-07-26 21:42:43,2025-12-27 05:07:28
3803,Transportes Roda y asociados S.L.N.E Modificado,solucionesyos.coop.@hotmail.com,2022-07-29 20:45:34,2025-12-27 05:07:28
3812,Zoraida Sierra Jove S.Coop. Modificado,industriasyjs.a.@outlook.com,2021-02-27 08:08:31,2025-12-27 05:07:28
3817,Tecnologías CAC S.Com. Modificado,fábricagalianos.coop.@gmail.com,2021-10-09 10:32:22,2025-12-27 05:07:28
3820,Hnos Villalonga S.Coop. Modificado,luís&asociadoss.com.@hotmail.com,2023-08-30 21:09:45,2025-12-27 05:07:28
3831,Familia Guardia S.Com. Modificado,barbayruedas.l.@gmail.com,2020-09-25 04:20:53,2025-12-27 05:07:28
3843,Taboada y asociados S.L.N.E Modificado,ricoyasociadoss.com.@hotmail.com,2021-06-16 11:03:52,2025-12-27 05:07:28
3845,Despacho Integrales S.A. Modificado,fábricagineryasociadoss.com.@gmail.com,2024-11-09 19:48:37,2025-12-27 05:07:28
3850,Hnos Mir S.Coop. Modificado,desarrolloromayasociadoss.com.@gmail.com,2020-11-25 16:07:40,2025-12-27 05:07:28
3853,Restauración CIO S.A.T. Modificado,compañíainternacionaless.a.@outlook.com,2022-02-17 20:52:41,2025-12-27 05:07:28
3854,Torrijos y Arco S.L.N.E Modificado,tatianamanzanoluques.l.l.@gmail.com,2021-08-20 12:28:44,2025-12-27 05:07:28
3856,Industrias Madrigal S.L.N.E Modificado,supermercadosenríquezyasociadoss.l.u.@hotmail.com,2022-02-16 03:32:45,2025-12-27 05:07:28
3857,Hnos Coll S.C.P Modificado,hotelclementes.l.@outlook.com,2021-08-08 04:52:43,2025-12-27 05:07:28
3860,Casals y Torrijos S.Com. Modificado,construcciónmiguels.com.@hotmail.com,2023-01-18 16:11:00,2025-12-27 05:07:28
3864,Transportes Salazar y asociados S.Com. Modificado,belensantosandreus.com.@outlook.com,2020-03-17 19:51:15,2025-12-27 05:07:28
3868,Supermercados ZI S.Coop. Modificado,hnostejedors.l.@gmail.com,2020-07-18 23:56:25,2025-12-27 05:07:28
3873,Roura y Feliu S.L. Modificado,promocionesilwjs.coop.@outlook.com,2020-12-29 13:40:28,2025-12-27 05:07:28
3899,Transportes Rius S.A. Modificado,alimentaciónugs.com.@gmail.com,2022-03-14 05:29:54,2025-12-27 05:07:28
3905,Transportes Mascaró & Asociados S.L.N.E Modificado,construcciónespañolass.a.@gmail.com,2021-11-18 16:42:17,2025-12-27 05:07:28
3921,Irene Pardo Buendía S.L.L. Modificado,eusebiograsherreras.com.@outlook.com,2020-07-02 20:01:57,2025-12-27 05:07:28
3924,Consultoría Molins y asociados S.Coop. Modificado,ríoycasess.coop.@gmail.com,2022-10-11 12:15:50,2025-12-27 05:07:28
3930,Iniesta & Asociados S.L.N.E Modificado,atienza&asociadoss.com.@gmail.com,2023-10-26 05:03:40,2025-12-27 05:07:28
3937,Hnos Barberá S.L. Modificado,serviciosespañolass.com.@outlook.com,2022-05-29 16:56:13,2025-12-27 05:07:28
3957,Inversiones Sotelo S.L. Modificado,finanzasibéricas.coop.@hotmail.com,2020-07-03 13:48:13,2025-12-27 05:07:28
3963,Hnos Cortés S.Com. Modificado,alfredorobledobautistas.a.t.@gmail.com,2024-10-29 17:01:43,2025-12-27 05:07:28
3966,Felix Cruz Enríquez S.Coop. Modificado,finanzasdelsurs.a.@hotmail.com,2024-05-21 07:42:22,2025-12-27 05:07:28
3976,Despacho del Levante S.C.P Modificado,farmaceúticafábregass.l.@gmail.com,2023-03-21 02:09:27,2025-12-27 05:07:28
3978,Familia Cervantes S.A. Modificado,tecnologíasmilláns.com.@gmail.com,2023-09-07 09:41:08,2025-12-27 05:07:28
3992,Carlito Carmona Ayala S.A.T. Modificado,berenguer&asociadoss.l.@hotmail.com,2023-04-05 00:21:32,2025-12-27 05:07:28
3998,Vicente & Asociados S.A. Modificado,bauzàyasociadoss.com.@gmail.com,2024-08-05 00:14:37,2025-12-27 05:07:28
4005,Melisa Aroca Peralta S.C.P Modificado,pujolyestradas.com.@hotmail.com,2024-12-10 07:39:33,2025-12-27 05:07:28
4008,Tecnologías NJF S.Coop. Modificado,hnosconesas.a.@gmail.com,2024-06-20 23:03:28,2025-12-27 05:07:28
4018,Grupo Valera S.Com. Modificado,domínguezyasociadoss.l.l.@hotmail.com,2022-03-24 16:43:42,2025-12-27 05:07:28
4022,Fábrica Donoso y asociados S.A. Modificado,agudoyasociadoss.l.l.@gmail.com,2020-05-05 07:52:48,2025-12-27 05:07:28
4024,Débora Vigil Miranda S.L. Modificado,suministroswns.com.@outlook.com,2021-06-28 14:32:56,2025-12-27 05:07:28
4040,Familia Manrique S.L. Modificado,solucionesqhups.a.@outlook.com,2022-10-11 03:19:58,2025-12-27 05:07:28
4067,Tecnologías Llanos & Asociados S.L.N.E Modificado,compañíakprjs.coop.@gmail.com,2021-07-31 22:57:48,2025-12-27 05:07:28
4068,Despacho LYH S.L. Modificado,sierrayvilars.l.@gmail.com,2020-02-20 04:49:52,2025-12-27 05:07:28
4083,Inversiones Macias y asociados S.C.P Modificado,jacintorosamoreras.coop.@hotmail.com,2023-06-04 04:26:47,2025-12-27 05:07:28
4088,Manuel Cortina Robles S.L.L. Modificado,octaviofeijooredondos.l.@hotmail.com,2023-10-30 07:36:15,2025-12-27 05:07:28
4112,Mariscal & Asociados S.Com. Modificado,familiapazs.a.@hotmail.com,2023-01-28 16:33:13,2025-12-27 05:07:28
4119,Pinedo y Iglesia S.Coop. Modificado,tecnologíascastellanas.l.l.@hotmail.com,2021-12-24 10:52:10,2025-12-27 05:07:28
4120,Arcelia Caballero Galan S.L.N.E Modificado,hnosmirós.com.@outlook.com,2020-05-10 05:16:58,2025-12-27 05:07:28
4141,Benigno Millán Cabañas S.A.T. Modificado,familiapavóns.a.@gmail.com,2023-12-10 08:41:28,2025-12-27 05:07:28
4151,Farmaceútica Jurado S.L. Modificado,familiacamachos.l.@outlook.com,2024-10-05 22:11:25,2025-12-27 05:07:28
4157,Compañía NH S.Coop. Modificado,murcia&asociadoss.a.@hotmail.com,2022-11-25 21:18:06,2025-12-27 05:07:28
4158,Familia Casal S.Com. Modificado,construccióntéllezs.l.n.e@hotmail.com,2024-06-01 23:19:59,2025-12-27 05:07:28
4159,Soluciones Nuñez y asociados S.L.N.E Modificado,bancosanzs.com.@gmail.com,2024-08-30 05:27:47,2025-12-27 05:07:28
4168,Consultoría del Norte S.Com. Modificado,manufacturasjps.coop.@gmail.com,2021-12-18 03:43:18,2025-12-27 05:07:28
