account_id,account_name,email,created_at,updated_at
4187,Compañía Heredia & Asociados S.Coop. Modificado,juanfranciscoayusodurans.a.d@gmail.com,2021-11-26 22:54:49,2025-12-27 05:07:28
4189,Desarrollo QT S.Com. Modificado,fábricaiglesias&asociadoss.com.@hotmail.com,2022-12-22 21:40:12,2025-12-27 05:07:28
4194,Murcia & Asociados S.Com. Modificado,segoviaynogueiras.com.@gmail.com,2020-05-09 02:03:54,2025-12-27 05:07:28
4196,Álvaro y asociados S.Com. Modificado,desarrollodelnoroestes.l.@hotmail.com,2024-05-29 04:29:56,2025-12-27 05:07:28
4201,Manufacturas Española S.Coop. Modificado,soléypolos.com.@outlook.com,2020-01-14 22:17:42,2025-12-27 05:07:28
4211,Grupo Barberá S.L.N.E Modificado,bernabéalvaradoescribanos.l.n.e@hotmail.com,2020-12-03 17:35:49,2025-12-27 05:07:28
4218,Familia Coello S.L.L. Modificado,serviciosets.com.@hotmail.com,2020-10-27 13:24:34,2025-12-27 05:07:28
4232,Zamora & Asociados S.L. Modificado,pérezyarrietas.c.p@hotmail.com,2021-02-25 18:32:06,2025-12-27 05:07:28
4245,Infraestructuras Avanzadas S.Com. Modificado,promocionesespañolass.l.@gmail.com,2021-03-27 05:12:55,2025-12-27 05:07:28
4249,Rojas y asociados S.L. Modificado,tejedorymartis.a.@hotmail.com,2020-02-10 22:07:08,2025-12-27 05:07:28
4294,Grupo Palacio S.Coop. Modificado,solucionesrosas.coop.@gmail.com,2024-09-06 18:10:18,2025-12-27 05:07:28
4296,Hermanos Terrón S.Coop. Modificado,industriasnevado&asociadoss.a.@gmail.com,2021-06-22 23:44:21,2025-12-27 05:07:28
4308,Despacho Lamas S.A.T. Modificado,bartolomégarcésrománs.a.@outlook.com,2022-11-11 17:22:33,2025-12-27 05:07:28
4312,Hnos Garzón S.C.P Modificado,industriasespañolas.l.l.@gmail.com,2021-02-28 20:37:38,2025-12-27 05:07:28
4313,Inmobiliaria Feliu S.L.L. Modificado,grupocastellanoss.a.@hotmail.com,2021-11-02 11:16:50,2025-12-27 05:07:28
4316,Distribuciones Llabrés & Asociados S.L.N.E Modificado,moyayduartes.coop.@gmail.com,2023-08-31 21:22:01,2025-12-27 05:07:28
4318,Torrijos y asociados S.Coop. Modificado,logísticainteligentess.com.@hotmail.com,2024-06-18 18:56:02,2025-12-27 05:07:28
4319,Rico y Barranco S.Coop. Modificado,suministroshzxks.l.@hotmail.com,2020-11-14 06:01:22,2025-12-27 05:07:28
4328,Familia Amores S.L. Modificado,industriaspachecos.coop.@gmail.com,2021-10-23 09:11:03,2025-12-27 05:07:28
4333,Cabrero y Alonso S.Com. Modificado,serviciosvalera&asociadoss.l.n.e@gmail.com,2020-05-30 04:20:06,2025-12-27 05:07:28
4339,Barberá & Asociados S.Com. Modificado,dávilayasociadoss.a.@outlook.com,2023-11-27 10:12:18,2025-12-27 05:07:28
4348,Compañía Cortes y asociados S.C.P Modificado,arteagayasociadoss.coop.@outlook.com,2021-11-18 13:45:11,2025-12-27 05:07:28
4356,Gonzalez & Asociados S.L.U. Modificado,badía&asociadoss.com.@hotmail.com,2021-09-01 12:59:03,2025-12-27 05:07:28
4360,Verdejo y asociados S.Coop. Modificado,fábricaglobaless.l.n.e@gmail.com,2021-11-06 07:08:17,2025-12-27 05:07:28
4362,Suministros YV S.L. Modificado,transportesdelsurs.a.@hotmail.com,2020-12-16 11:07:09,2025-12-27 05:07:28
4366,Infraestructuras Sosa S.A. Modificado,alimentaciónlópezs.l.@outlook.com,2020-12-10 03:56:42,2025-12-27 05:07:28
4373,Zapata & Asociados S.L. Modificado,agapitobustosfrutoss.l.n.e@outlook.com,2023-02-10 03:35:20,2025-12-27 05:07:28
4413,Farmaceútica WYY S.A. Modificado,bárcena&asociadoss.l.@hotmail.com,2023-01-15 06:37:06,2025-12-27 05:07:28
4415,Inversiones Españolas S.Coop. Modificado,inmobiliariainternacionaless.com.@outlook.com,2022-06-13 22:24:54,2025-12-27 05:07:28
4418,Casemiro Lledó Correa S.Com. Modificado,mineríacrespos.l.n.e@outlook.com,2022-04-10 00:06:17,2025-12-27 05:07:28
4419,Manufacturas RD S.A. Modificado,batallaytalaveras.l.u.@gmail.com,2020-08-18 22:56:01,2025-12-27 05:07:28
4423,Arco y Martí S.Com. Modificado,isapujolnietos.a.@hotmail.com,2021-05-15 03:49:05,2025-12-27 05:07:28
4440,Banca Privada Bermejo & Asociados S.Coop. Modificado,bancointernacionaless.coop.@gmail.com,2021-12-29 15:10:33,2025-12-27 05:07:28
4441,Suministros Orozco S.A. Modificado,lilianafajardogutiérrezs.l.@hotmail.com,2021-01-14 23:29:15,2025-12-27 05:07:28
4445,Calatayud y asociados S.Coop. Modificado,rubénterróncasass.l.@hotmail.com,2022-06-14 12:18:33,2025-12-27 05:07:28
4446,Infraestructuras Hidalgo S.Coop. Modificado,logísticavilaplanayasociadoss.l.n.e@hotmail.com,2022-06-08 12:37:40,2025-12-27 05:07:28
4450,Glauco Coloma Noguera S.Coop. Modificado,desarrollocus.a.@hotmail.com,2023-03-08 03:53:32,2025-12-27 05:07:28
4454,Construcción NB S.Com. Modificado,joséprietoseguís.a.@gmail.com,2021-10-09 21:12:54,2025-12-27 05:07:28
4455,Néstor Bolaños Valenciano S.Com. Modificado,construcciónagudos.l.l.@hotmail.com,2022-09-02 07:09:27,2025-12-27 05:07:28
4466,Casemiro Cózar Nogués S.Coop. Modificado,talleresibéricas.com.@hotmail.com,2021-05-05 14:06:08,2025-12-27 05:07:28
4481,Daniela Núñez Estrada S.L.N.E Modificado,logísticadelnortes.l.@hotmail.com,2024-03-12 09:27:39,2025-12-27 05:07:28
4508,Clementina Corominas Matas S.Coop. Modificado,mineríanadalyasociadoss.coop.@gmail.com,2022-02-08 21:04:54,2025-12-27 05:07:28
4518,Linares y asociados S.C.P Modificado,inmobiliariafybrs.com.@gmail.com,2021-10-06 10:20:30,2025-12-27 05:07:28
4531,Gomez & Asociados S.L. Modificado,manufacturasuhss.l.n.e@hotmail.com,2023-05-26 17:41:44,2025-12-27 05:07:28
4537,Hermanos Fuster S.L. Modificado,franciscojaviercánovasluíss.a.@hotmail.com,2022-08-08 18:02:55,2025-12-27 05:07:28
4541,Blanes y Aranda S.Coop. Modificado,familiamolinas.coop.@gmail.com,2024-11-13 18:29:55,2025-12-27 05:07:28
4542,Nogués & Asociados S.Coop. Modificado,benetyllabréss.com.@hotmail.com,2022-04-22 01:38:02,2025-12-27 05:07:28
4544,Ruiz & Asociados S.A. Modificado,beatrizcalatayudarranzs.l.n.e@outlook.com,2021-06-01 08:56:22,2025-12-27 05:07:28
4545,Porta & Asociados S.Coop. Modificado,hotelanguloyasociadoss.com.@hotmail.com,2020-04-22 18:57:09,2025-12-27 05:07:28
4546,Hnos Duran S.L. Modificado,quinteroyasociadoss.coop.@hotmail.com,2020-03-14 01:34:29,2025-12-27 05:07:28
4555,Banco JMD S.Coop. Modificado,rierayasociadoss.l.n.e@hotmail.com,2021-05-20 02:31:43,2025-12-27 05:07:28
4563,Cases y Angulo S.A.U Modificado,logísticagualyasociadoss.l.u.@hotmail.com,2022-05-31 15:37:52,2025-12-27 05:07:28
4565,Minería LDE S.A.U Modificado,ramosyasociadoss.l.@hotmail.com,2021-08-22 13:43:04,2025-12-27 05:07:28
4572,Bellido y Gonzalez S.L. Modificado,consultoríachacónyasociadoss.a.@outlook.com,2022-05-10 01:19:03,2025-12-27 05:07:28
4580,Morán y Menéndez S.L. Modificado,alimentaciónespañolas.l.@hotmail.com,2020-07-19 02:14:42,2025-12-27 05:07:28
4590,Manufacturas Palma S.A. Modificado,mineríapareja&asociadoss.c.p@hotmail.com,2022-07-18 15:52:00,2025-12-27 05:07:28
4607,Inmobiliaria SKD S.Com. Modificado,hnospujadass.a.t.@gmail.com,2020-08-25 13:14:46,2025-12-27 05:07:28
4622,Promociones Manjón S.A. Modificado,finanzastzps.a.t.@outlook.com,2023-09-10 07:21:53,2025-12-27 05:07:28
4623,Compañía HYOF S.C.P Modificado,alberdi&asociadoss.l.@gmail.com,2021-01-02 15:47:24,2025-12-27 05:07:28
4626,Jose Carlos Jara Castejón S.L.L. Modificado,comercialgffs.l.@hotmail.com,2021-09-13 16:27:37,2025-12-27 05:07:28
4638,Reynaldo Gordillo Lloret S.A. Modificado,construcciónroigyasociadoss.l.l.@outlook.com,2020-11-08 22:56:56,2025-12-27 05:07:28
4639,Torres & Asociados S.L.L. Modificado,desarrolloibéricas.l.n.e@outlook.com,2022-06-06 05:08:06,2025-12-27 05:07:28
4640,Talleres Verdú & Asociados S.L.L. Modificado,infraestructurascañass.a.@hotmail.com,2024-08-28 04:54:07,2025-12-27 05:07:28
4646,Compañía Zapata & Asociados S.C.P Modificado,distribucionesglobaless.a.@gmail.com,2020-10-13 05:26:15,2025-12-27 05:07:28
4654,Hnos Montaña S.Com. Modificado,adelinamoratadurans.l.@gmail.com,2020-02-11 06:02:05,2025-12-27 05:07:28
4665,Familia Martí S.A. Modificado,familiapolos.a.@hotmail.com,2024-05-04 23:18:30,2025-12-27 05:07:28
4670,Vazquez y asociados S.C.P Modificado,farmaceúticapgs.a.t.@gmail.com,2021-06-25 07:06:46,2025-12-27 05:07:28
4681,Hermanos Cruz S.L.N.E Modificado,despachodelmediterráneos.coop.@hotmail.com,2023-07-08 15:03:55,2025-12-27 05:07:28
4691,Hnos Muñoz S.L.N.E Modificado,tallerestns.l.@hotmail.com,2023-03-12 10:04:10,2025-12-27 05:07:28
4696,Zaragoza & Asociados S.Coop. Modificado,bustamanteyasociadoss.com.@outlook.com,2020-07-04 20:19:48,2025-12-27 05:07:28
4700,Borrell & Asociados S.Coop. Modificado,manufacturasqizgs.com.@hotmail.com,2021-07-16 14:56:26,2025-12-27 05:07:28
4701,Osuna & Asociados S.L. Modificado,finanzasméndezyasociadoss.l.n.e@gmail.com,2020-03-07 18:17:04,2025-12-27 05:07:28
4722,Marcial García Aguado S.Com. Modificado,hermanosvalverdes.l.@hotmail.com,2022-06-27 02:15:36,2025-12-27 05:07:28
4726,Cornelio Moreno Bastida S.L.L. Modificado,ríosyasociadoss.l.@outlook.com,2022-11-27 12:58:20,2025-12-27 05:07:28
4744,Alejo Villegas Cortina S.L.N.E Modificado,hermanosmalos.coop.@hotmail.com,2022-02-09 05:31:44,2025-12-27 05:07:28
4756,Marti y Landa S.L.L. Modificado,despachoibéricoss.l.@outlook.com,2024-12-11 01:13:23,2025-12-27 05:07:28
4765,Emperatriz Ponce Sáenz S.A.T. Modificado,tomas&asociadoss.l.@outlook.com,2021-08-02 18:29:27,2025-12-27 05:07:28
4766,Talleres Guzman S.A. Modificado,samper&asociadoss.c.p@hotmail.com,2021-12-13 20:50:21,2025-12-27 05:07:28
4780,Francisco Jose Blanca Taboada S.Coop. Modificado,servicioschavess.c.p@hotmail.com,2022-01-18 05:39:28,2025-12-27 05:07:28
4787,Familia Cuesta S.C.P Modificado,construcciónnxes.a.@gmail.com,2021-08-04 22:45:46,2025-12-27 05:07:28
4792,Alimentación XQE S.L.N.E Modificado,lopegallomiguels.c.p@hotmail.com,2022-11-20 12:36:15,2025-12-27 05:07:28
4795,Heraclio Ortuño Saura S.L.N.E Modificado,finanzasiñiguez&asociadoss.a.@hotmail.com,2020-03-07 07:09:28,2025-12-27 05:07:28
4796,Tecnologías León S.A. Modificado,promocionesfabra&asociadoss.l.@gmail.com,2020-03-20 16:27:38,2025-12-27 05:07:28
4811,Desarrollo del Norte S.A.D Modificado,supermercadoscqihs.l.n.e@outlook.com,2021-06-14 19:20:45,2025-12-27 05:07:28
4814,Hermanos Isern S.Coop. Modificado,desarrollotaboadas.com.@hotmail.com,2020-08-28 00:11:45,2025-12-27 05:07:28
4815,Fábrica Marin y asociados S.Com. Modificado,promocionesiberias.c.p@hotmail.com,2024-06-14 18:15:27,2025-12-27 05:07:28
4834,Comercializadora Castellana S.L. Modificado,hermanospardos.a.@gmail.com,2021-11-16 15:06:38,2025-12-27 05:07:28
4845,Promociones Española S.A. Modificado,restauraciónguitarts.com.@gmail.com,2024-05-16 06:10:32,2025-12-27 05:07:28
4867,Grupo Ferrando S.A. Modificado,hotelcapdevilayasociadoss.a.@hotmail.com,2022-04-17 22:48:37,2025-12-27 05:07:28
4887,Cerdán y Cuesta S.L.L. Modificado,herbertoescolanomartínezs.a.@outlook.com,2021-10-10 02:16:09,2025-12-27 05:07:28
4890,Colomer y asociados S.L.L. Modificado,valencianoymarís.l.n.e@gmail.com,2020-07-30 22:22:42,2025-12-27 05:07:28
4898,Distribuciones Avanzadas S.Coop. Modificado,nuriareguerasorias.com.@outlook.com,2021-06-05 00:56:43,2025-12-27 05:07:28
4915,Banco Robles y asociados S.L. Modificado,transportescrespoyasociadoss.l.@outlook.com,2020-04-03 21:30:35,2025-12-27 05:07:28
4920,Suministros Gordillo y asociados S.Coop. Modificado,tecnologíasjpks.l.n.e@outlook.com,2021-12-05 08:25:50,2025-12-27 05:07:28
4926,Desarrollo del Norte S.L.L. Modificado,familiaparejas.l.@outlook.com,2022-02-10 23:42:45,2025-12-27 05:07:28
4937,Familia Haro S.Coop. Modificado,comercializadorabaróyasociadoss.a.@hotmail.com,2022-07-01 01:38:36,2025-12-27 05:07:28
4954,Infraestructuras Miralles y asociados S.Coop. Modificado,familialuzs.l.@gmail.com,2022-09-04 06:17:44,2025-12-27 05:07:28
4957,Grupo Blanch S.A. Modificado,servicioscastrilloyasociadoss.a.@outlook.com,2020-09-10 02:43:15,2025-12-27 05:07:28
4968,Compañía Españolas S.L.L. Modificado,lucasyolmedos.a.@hotmail.com,2022-08-30 03:18:28,2025-12-27 05:07:28
4984,Cordero y Montalbán S.Com. Modificado,buenaventuramurciabauzàs.l.u.@outlook.com,2020-01-31 16:14:42,2025-12-27 05:07:28
4986,Madrid y Cáceres S.Com. Modificado,transportesplanas.coop.@hotmail.com,2022-10-05 20:50:01,2025-12-27 05:07:28
4989,René Perelló Prado S.C.P Modificado,hnosbermúdezs.c.p@outlook.com,2023-01-11 13:44:33,2025-12-27 05:07:28
5014,Hermanos Vila S.Coop. Modificado,infraestructurasqrs.a.@outlook.com,2022-05-06 07:53:02,2025-12-27 05:07:28
5035,Borja y Herranz S.Com. Modificado,alimentaciónsuárezs.l.n.e@gmail.com,2022-07-20 20:28:54,2025-12-27 05:07:28
5044,Grupo Gallo S.A. Modificado,manufacturasbatlles.coop.@gmail.com,2022-06-05 06:15:36,2025-12-27 05:07:28
5046,Nebot y Miró S.L. Modificado,instalacionesbwabs.com.@outlook.com,2022-08-28 13:55:43,2025-12-27 05:07:28
5067,Restauración YUYF S.Com. Modificado,salasypalomars.l.@gmail.com,2024-02-19 04:32:41,2025-12-27 05:07:28
5069,Hermanos Estévez S.L. Modificado,consultoríamulets.com.@hotmail.com,2020-03-24 04:08:53,2025-12-27 05:07:28
5078,Alimentación Integrales S.L.N.E Modificado,barberoymoraless.a.@hotmail.com,2022-02-18 09:55:22,2025-12-27 05:07:28
5087,Rey y asociados S.L.N.E Modificado,bancograss.coop.@gmail.com,2021-10-31 14:56:43,2025-12-27 05:07:28
5096,Inmobiliaria FD S.A. Modificado,suministrosdelnoroestes.a.@hotmail.com,2020-08-15 16:30:07,2025-12-27 05:07:28
5111,Consultoría ZPKQ S.Coop. Modificado,espadayasociadoss.l.n.e@gmail.com,2022-01-05 11:21:09,2025-12-27 05:07:28
5113,Reig y asociados S.A. Modificado,hnossampers.com.@gmail.com,2023-02-15 06:18:37,2025-12-27 05:07:28
5115,Servicios Botella S.L. Modificado,noésomozacuestas.coop.@outlook.com,2022-03-12 06:26:04,2025-12-27 05:07:28
5116,Familia Manzanares S.Com. Modificado,bancoramírezs.a.@hotmail.com,2021-09-01 18:38:39,2025-12-27 05:07:28
5118,Supermercados ED S.A. Modificado,hnosbustamantes.com.@outlook.com,2022-03-13 20:22:55,2025-12-27 05:07:28
5122,Hnos Cuesta S.L.N.E Modificado,marcelinocabanillastovars.com.@outlook.com,2022-12-28 14:33:08,2025-12-27 05:07:28
5124,Peñalver & Asociados S.L.L. Modificado,hermanosarenass.coop.@outlook.com,2024-06-25 21:55:07,2025-12-27 05:07:28
5130,Instalaciones Pedraza S.A. Modificado,herranzyaparicios.a.@gmail.com,2021-12-25 12:17:53,2025-12-27 05:07:28
5141,Lola Elorza Zamora S.Com. Modificado,supermercadosglobaless.l.l.@outlook.com,2021-07-04 20:46:00,2025-12-27 05:07:28
5152,Fábrica Iberia S.L. Modificado,industriasvalderramas.a.@gmail.com,2023-09-28 07:53:15,2025-12-27 05:07:28
5163,Gracia & Asociados S.Com. Modificado,noguerayibañezs.com.@hotmail.com,2022-11-06 04:10:01,2025-12-27 05:07:28
5176,Alimentación Manjón y asociados S.L. Modificado,familiacazorlas.com.@outlook.com,2020-02-19 22:36:44,2025-12-27 05:07:28
5225,Esmeralda Aparicio Meléndez S.L.U. Modificado,boschycerveras.a.@gmail.com,2020-11-13 13:59:29,2025-12-27 05:07:28
5290,Comercializadora Iberia S.C.P Modificado,logísticaplanas.l.n.e@hotmail.com,2021-09-14 06:02:03,2025-12-27 05:07:28
5291,Inversiones ST S.L.U. Modificado,reigyasociadoss.coop.@hotmail.com,2024-05-07 18:36:26,2025-12-27 05:07:28
5303,Transportes Montero S.Com. Modificado,alfredodiezbellos.l.n.e@gmail.com,2022-05-01 12:51:11,2025-12-27 05:07:28
5306,Morante y asociados S.C.P Modificado,bancointernacionaless.l.@gmail.com,2022-02-23 20:50:50,2025-12-27 05:07:28
5310,Garriga y Alberdi S.A. Modificado,supermercadosios.com.@hotmail.com,2020-04-11 04:16:45,2025-12-27 05:07:28
5319,Nogueira y Figueroa S.L. Modificado,ángelaromanfonsecas.l.@hotmail.com,2021-03-24 22:23:23,2025-12-27 05:07:28
5324,Infraestructuras Ibéricos S.Com. Modificado,hnoscampillos.coop.@outlook.com,2020-09-15 10:22:32,2025-12-27 05:07:28
5329,Rebollo y Ramírez S.A. Modificado,hnosalcántaras.l.l.@gmail.com,2024-08-16 11:46:41,2025-12-27 05:07:28
5340,Hnos Solís S.L.N.E Modificado,jaimesarabiapinos.l.l.@hotmail.com,2020-06-30 09:24:39,2025-12-27 05:07:28
5348,Finanzas Aznar S.L. Modificado,jennifercarballogarays.coop.@outlook.com,2020-12-04 11:42:33,2025-12-27 05:07:28
5359,Millán & Asociados S.A. Modificado,promocionesmnrps.com.@hotmail.com,2023-08-03 03:35:49,2025-12-27 05:07:28
5366,Jenaro Artigas Díez S.Coop. Modificado,hnosmontess.l.@outlook.com,2023-12-11 09:38:37,2025-12-27 05:07:28
5377,Hotel SIT S.L. Modificado,mineríaespañol&asociadoss.a.@gmail.com,2023-07-03 20:50:19,2025-12-27 05:07:28
5379,Promociones Gimenez S.Coop. Modificado,teruelyzorrillas.coop.@outlook.com,2022-09-19 12:52:45,2025-12-27 05:07:28
5395,Promociones Marquez y asociados S.A. Modificado,castilla&asociadoss.com.@outlook.com,2021-09-03 15:25:58,2025-12-27 05:07:28
5400,Chacón y Jerez S.L.N.E Modificado,alimentaciónnbyzs.c.p@outlook.com,2022-04-23 08:30:36,2025-12-27 05:07:28
5401,Grupo Benet S.A. Modificado,inversionesrobless.a.@outlook.com,2024-01-03 00:30:37,2025-12-27 05:07:28
5452,Ignacia Ayala Olivé S.A. Modificado,servicioslerma&asociadoss.l.l.@hotmail.com,2021-12-11 06:44:02,2025-12-27 05:07:28
5472,Comercializadora Española S.A. Modificado,alimentaciónnls.l.n.e@outlook.com,2023-10-17 03:59:52,2025-12-27 05:07:28
5477,Hotel Borrás & Asociados S.Com. Modificado,hnoszuritas.a.t.@hotmail.com,2024-10-24 21:48:12,2025-12-27 05:07:28
5480,Inmobiliaria VEUM S.A. Modificado,serviciosmayorals.l.l.@hotmail.com,2023-08-31 01:23:22,2025-12-27 05:07:28
5483,Expósito y asociados S.Coop. Modificado,finanzasubpas.coop.@outlook.com,2023-08-24 08:12:27,2025-12-27 05:07:28
5486,Soluciones BPXK S.L. Modificado,finanzasheredia&asociadoss.l.n.e@outlook.com,2020-08-21 05:04:35,2025-12-27 05:07:28
5503,Bustamante y asociados S.Com. Modificado,comercialavanzadass.a.@outlook.com,2021-05-15 17:16:42,2025-12-27 05:07:28
5512,Arce y Carretero S.Coop. Modificado,inversionesdelmediterráneos.coop.@gmail.com,2020-01-21 04:43:52,2025-12-27 05:07:28
5513,Infraestructuras Gascón y asociados S.L. Modificado,hotelduráns.com.@gmail.com,2020-04-19 01:43:44,2025-12-27 05:07:28
5523,Servicios Ibéricos S.L.U. Modificado,fábricafbuds.l.n.e@outlook.com,2020-07-09 21:13:32,2025-12-27 05:07:28
5533,Azucena Acero Nadal S.Coop. Modificado,farmaceúticaibéricoss.l.@hotmail.com,2022-09-11 11:55:20,2025-12-27 05:07:28
5546,Inmobiliaria Españolas S.L.U. Modificado,suministrosiberias.l.n.e@gmail.com,2021-02-03 16:15:58,2025-12-27 05:07:28
5566,Piña y Pol S.Coop. Modificado,joveryguzmáns.coop.@gmail.com,2023-01-24 08:57:11,2025-12-27 05:07:28
5573,Talleres del Noroeste S.Coop. Modificado,manufacturasherranzs.c.p@hotmail.com,2024-09-08 03:20:14,2025-12-27 05:07:28
5577,Suministros Ibérica S.Com. Modificado,sernaymachados.l.@hotmail.com,2024-03-21 10:45:17,2025-12-27 05:07:28
5593,Comercializadora MDPQ S.A.T. Modificado,hnoscolomers.l.n.e@gmail.com,2021-04-26 07:53:19,2025-12-27 05:07:28
5608,Suministros Chico y asociados S.L. Modificado,logísticaespañolass.com.@outlook.com,2021-03-15 08:25:34,2025-12-27 05:07:28
5614,Hermanos Villena S.C.P Modificado,consuelojuanmarins.com.@gmail.com,2021-12-10 09:47:26,2025-12-27 05:07:28
5615,Tecnologías del Mediterráneo S.L. Modificado,supermercadosmorerayasociadoss.l.@outlook.com,2021-10-17 09:27:09,2025-12-27 05:07:28
5619,Tecnologías DRH S.Coop. Modificado,promocionesibéricoss.l.l.@hotmail.com,2023-03-31 19:18:59,2025-12-27 05:07:28
5625,Distribuciones Integrales S.L. Modificado,sánchezyrouras.a.@gmail.com,2022-07-08 00:07:58,2025-12-27 05:07:28
5640,Despacho Ibérica S.L.L. Modificado,carlosyasociadoss.a.@gmail.com,2020-01-03 08:41:40,2025-12-27 05:07:28
5643,Ferrero y asociados S.L.L. Modificado,consultoríaguardiola&asociadoss.l.@hotmail.com,2020-04-08 09:43:12,2025-12-27 05:07:28
5651,Benita Gallardo Olivares S.L. Modificado,comercialabs.a.@outlook.com,2024-09-11 19:38:32,2025-12-27 05:07:28
5652,Mateu y Linares S.A. Modificado,elíaszaragozamínguezs.l.@outlook.com,2024-06-13 12:23:19,2025-12-27 05:07:28
5660,Minería TE S.L. Modificado,alimentacióndellevantes.l.n.e@gmail.com,2021-01-01 10:26:32,2025-12-27 05:07:28
5668,Alimentación del Levante S.C.P Modificado,serviciospadillas.coop.@hotmail.com,2023-03-18 11:37:32,2025-12-27 05:07:28
5672,Familia Correa S.Coop. Modificado,infraestructurasdelnortes.c.p@hotmail.com,2021-03-14 11:56:49,2025-12-27 05:07:28
5683,Inmobiliaria Marquez & Asociados S.Coop. Modificado,delgadoyrodas.a.@gmail.com,2020-09-30 07:11:01,2025-12-27 05:07:28
5685,Inversiones Bautista S.C.P Modificado,mineríadelmediterráneos.a.@gmail.com,2020-02-12 19:44:09,2025-12-27 05:07:28
5695,Hnos Talavera S.C.P Modificado,guillenyasociadoss.l.@gmail.com,2024-10-06 21:44:49,2025-12-27 05:07:28
5696,Ballesteros y Escrivá S.C.P Modificado,zacaríaslermacorderos.coop.@gmail.com,2023-10-03 03:55:07,2025-12-27 05:07:28
5705,Verdú & Asociados S.Coop. Modificado,almeidaycisneross.coop.@gmail.com,2024-06-17 20:30:46,2025-12-27 05:07:28
5710,Dionisio Raya Morán S.A. Modificado,mineríaespañolas.a.@hotmail.com,2020-07-26 08:26:23,2025-12-27 05:07:28
5714,Instalaciones Cantón & Asociados S.L.N.E Modificado,fábricafgks.a.@hotmail.com,2021-05-27 08:34:10,2025-12-27 05:07:28
5718,Fábrica Villaverde y asociados S.Com. Modificado,infraestructurasenzs.coop.@outlook.com,2021-12-07 15:07:47,2025-12-27 05:07:28
5739,Hilda Acero Cañete S.L. Modificado,adadiayrochas.coop.@gmail.com,2021-12-31 05:51:37,2025-12-27 05:07:28
5751,Inmobiliaria del Mediterráneo S.Coop. Modificado,clementinasorianobonillas.a.@gmail.com,2022-08-03 12:05:34,2025-12-27 05:07:28
5757,Distribuciones Integrales S.L.N.E Modificado,tecnologíasbvlqs.coop.@hotmail.com,2021-04-07 10:47:35,2025-12-27 05:07:28
5765,León y Perales S.L.N.E Modificado,supermercadosinteligentess.a.@hotmail.com,2023-02-12 11:08:16,2025-12-27 05:07:28
5770,Minería Bernat S.A.U Modificado,beatrizrosellóamors.l.n.e@outlook.com,2024-02-27 07:49:27,2025-12-27 05:07:28
5771,Roque Echevarría Balaguer S.A. Modificado,supermercadosyvxs.l.l.@hotmail.com,2022-10-16 04:11:55,2025-12-27 05:07:28
5797,Caballero y Calderon S.Com. Modificado,sastreyasociadoss.l.@gmail.com,2020-11-24 23:34:18,2025-12-27 05:07:28
5812,Talleres Miranda y asociados S.Coop. Modificado,mónicapadillagómezs.coop.@gmail.com,2022-05-19 21:15:57,2025-12-27 05:07:28
5813,Vigil & Asociados S.L.L. Modificado,ricoyasociadoss.l.@hotmail.com,2020-08-19 08:47:42,2025-12-27 05:07:28
5815,Nadal & Asociados S.A.T. Modificado,logísticapugas.l.n.e@gmail.com,2022-09-03 23:49:50,2025-12-27 05:07:28
5817,Finanzas Pinilla y asociados S.A.U Modificado,sobrinoyyustes.l.@outlook.com,2023-04-02 00:06:18,2025-12-27 05:07:28
5823,Lino Escudero Villanueva S.Coop. Modificado,sanabriaypozas.a.@outlook.com,2020-04-01 21:24:54,2025-12-27 05:07:28
5837,Vilar y Merino S.L.N.E Modificado,familiapellicers.a.@gmail.com,2020-12-30 03:31:04,2025-12-27 05:07:28
5841,Leocadio Céspedes Jerez S.L.N.E Modificado,transportesevks.coop.@outlook.com,2023-12-26 09:57:05,2025-12-27 05:07:28
5855,Promociones Marti y asociados S.Com. Modificado,mineríainteligentess.coop.@hotmail.com,2022-07-12 01:06:42,2025-12-27 05:07:28
5861,Díaz y Estevez S.L. Modificado,alimentacióndelnortes.l.l.@gmail.com,2021-03-18 04:01:14,2025-12-27 05:07:28
5864,Macias & Asociados S.Com. Modificado,fábricaats.coop.@outlook.com,2021-06-17 18:21:17,2025-12-27 05:07:28
5876,Grupo Crespo S.A. Modificado,comercializadoracastellanas.l.u.@gmail.com,2023-11-03 00:38:33,2025-12-27 05:07:28
5883,Luciana Riquelme Valverde S.Coop. Modificado,promocionesjaras.com.@hotmail.com,2023-09-26 09:17:39,2025-12-27 05:07:28
5889,Fábrica HDAA S.L.N.E Modificado,liliacarranzavivess.l.@hotmail.com,2020-05-31 07:25:29,2025-12-27 05:07:28
5898,Talleres Sanz y asociados S.L.U. Modificado,felicianoabadgómezs.com.@outlook.com,2022-07-22 07:07:10,2025-12-27 05:07:28
5899,Inmobiliaria Lastra S.L.N.E Modificado,comercializadoravelascos.com.@outlook.com,2020-04-30 15:05:17,2025-12-27 05:07:28
5902,Hnos Gutierrez S.A. Modificado,tallereslds.c.p@gmail.com,2020-03-11 19:59:28,2025-12-27 05:07:28
5907,Edu Perera Aranda S.Com. Modificado,tecnologíasibéricoss.coop.@outlook.com,2021-10-02 23:44:52,2025-12-27 05:07:28
5924,Infraestructuras LK S.Coop. Modificado,edelmiratomascabanillass.com.@outlook.com,2021-07-15 11:24:06,2025-12-27 05:07:28
5935,Suministros Lladó S.L.N.E Modificado,despachosolera&asociadoss.coop.@outlook.com,2020-08-31 09:58:05,2025-12-27 05:07:28
5949,Familia Ramón S.L.L. Modificado,faustobustamanteleivas.l.l.@hotmail.com,2021-12-03 20:03:19,2025-12-27 05:07:28
5954,Alimentación Melero S.A.U Modificado,barbaysandovals.a.@gmail.com,2021-11-16 17:11:20,2025-12-27 05:07:28
5963,Logística Agustí S.C.P Modificado,bernabémaciasacuñas.coop.@outlook.com,2020-05-26 23:21:09,2025-12-27 05:07:28
5977,Hnos Álamo S.L. Modificado,manufacturasávila&asociadoss.l.@outlook.com,2020-07-13 23:03:23,2025-12-27 05:07:28
5986,Consultoría DL S.L.N.E Modificado,industriasálvaros.coop.@hotmail.com,2021-11-08 14:29:28,2025-12-27 05:07:28
5988,Comercializadora Manso S.Coop. Modificado,marciaarcosgimenezs.com.@hotmail.com,2020-03-02 01:26:47,2025-12-27 05:07:28
5990,Promociones AH S.L.N.E Modificado,supermercadoskis.l.n.e@outlook.com,2022-12-02 02:08:02,2025-12-27 05:07:28
6011,Suministros Vega & Asociados S.A. Modificado,compañíamas.l.n.e@outlook.com,2021-12-27 08:24:57,2025-12-27 05:07:28
6019,Santiago y Cervantes S.Coop. Modificado,vivesyclaveros.c.p@gmail.com,2020-10-24 13:31:03,2025-12-27 05:07:28
6040,Talleres Gisbert & Asociados S.Coop. Modificado,finanzasintegraless.l.@hotmail.com,2020-10-29 02:44:01,2025-12-27 05:07:28
6102,Grupo Santos S.Com. Modificado,supermercadoscarrascos.com.@gmail.com,2022-08-09 22:18:37,2025-12-27 05:07:28
6110,Logística Verdugo y asociados S.A. Modificado,farmaceúticaamors.com.@hotmail.com,2024-05-11 19:17:09,2025-12-27 05:07:28
6115,Alcántara y asociados S.L.N.E Modificado,desarrollolermayasociadoss.l.@hotmail.com,2020-07-17 01:59:08,2025-12-27 05:07:28
6134,Hermanos Jáuregui S.L. Modificado,restauraciónamors.l.@hotmail.com,2020-08-23 20:54:00,2025-12-27 05:07:28
6150,Amado Beltran Valcárcel S.Com. Modificado,tejadayguilléns.a.t.@gmail.com,2022-09-18 20:08:21,2025-12-27 05:07:28
