account_id,account_name,email,created_at,updated_at
6152,Instalaciones CRA S.A. Modificado,desarrolloechevarrías.l.l.@hotmail.com,2023-07-27 03:43:00,2025-12-27 05:07:28
6160,Soria y Amaya S.L.U. Modificado,supermercadosbartoloméyasociadoss.a.@hotmail.com,2024-01-30 11:52:00,2025-12-27 05:07:28
6168,Guardiola & Asociados S.L. Modificado,restauraciónherrero&asociadoss.l.n.e@gmail.com,2022-05-01 11:36:31,2025-12-27 05:07:28
6171,Desarrollo Pizarro S.Com. Modificado,barcoyclaveros.l.@hotmail.com,2021-03-13 05:15:05,2025-12-27 05:07:28
6179,Supermercados Marco S.L. Modificado,blaszabalabautistas.l.@hotmail.com,2021-12-24 07:36:55,2025-12-27 05:07:28
6189,Alimentación Española S.A.T. Modificado,comercialhps.a.@hotmail.com,2023-05-09 17:30:32,2025-12-27 05:07:28
6192,Infraestructuras Alarcón & Asociados S.L. Modificado,samperyharos.l.l.@gmail.com,2022-10-26 13:47:42,2025-12-27 05:07:28
6196,Familia Feliu S.A. Modificado,industriasgelaberts.l.u.@gmail.com,2022-07-26 13:18:16,2025-12-27 05:07:28
6198,Soler y Saavedra S.L. Modificado,finanzascqsis.a.@outlook.com,2021-06-26 07:32:39,2025-12-27 05:07:28
6212,Hnos Marcos S.A. Modificado,fontycapdevilas.c.p@hotmail.com,2021-07-07 19:08:36,2025-12-27 05:07:28
6215,Compañía Garmendia S.L. Modificado,construcciónmínguezs.l.@outlook.com,2021-06-28 15:39:48,2025-12-27 05:07:28
6218,Benet y asociados S.L.N.E Modificado,familiatamarits.a.@outlook.com,2023-09-20 11:22:57,2025-12-27 05:07:28
6222,Cristóbal Juárez Campillo S.L.N.E Modificado,hermanospinos.coop.@hotmail.com,2022-05-03 14:52:02,2025-12-27 05:07:28
6226,Perla Morcillo Ríos S.Com. Modificado,beltrán&asociadoss.com.@gmail.com,2024-11-19 08:51:53,2025-12-27 05:07:28
6242,Banco CC S.L. Modificado,moles&asociadoss.coop.@outlook.com,2020-04-23 15:44:50,2025-12-27 05:07:28
6243,Hnos Castro S.C.P Modificado,distribucioneshigueras&asociadoss.com.@outlook.com,2024-01-21 07:38:03,2025-12-27 05:07:28
6244,Despacho Gallart y asociados S.A. Modificado,fernandezyasociadoss.a.@outlook.com,2020-02-06 09:41:33,2025-12-27 05:07:28
6250,Comercial Barros y asociados S.A.U Modificado,bancoarenass.com.@hotmail.com,2020-11-22 16:19:13,2025-12-27 05:07:28
6253,Comercial Ribes S.L.N.E Modificado,núñezyasociadoss.l.@outlook.com,2023-07-30 20:03:20,2025-12-27 05:07:28
6265,Hnos Boada S.L.N.E Modificado,vicenteyasociadoss.c.p@gmail.com,2021-05-16 18:36:57,2025-12-27 05:07:28
6273,Juanita Rivero Sancho S.A. Modificado,distribucionestejadas.a.u@outlook.com,2020-09-18 18:11:53,2025-12-27 05:07:28
6285,Industrias Castellana S.A. Modificado,severianoiriartegoñis.coop.@outlook.com,2021-06-09 17:48:06,2025-12-27 05:07:28
6289,Hotel VFLM S.Com. Modificado,despachoeqs.coop.@outlook.com,2023-06-13 15:54:47,2025-12-27 05:07:28
6298,Eleuterio Puente Manzano S.A. Modificado,elpidiotejerobarrals.coop.@gmail.com,2022-10-05 06:16:11,2025-12-27 05:07:28
6301,Comercial Laguna S.Com. Modificado,restauracióndelmediterráneos.a.@outlook.com,2021-10-27 23:15:10,2025-12-27 05:07:28
6309,Farmaceútica Españolas S.C.P Modificado,inmobiliariabárcenas.com.@outlook.com,2022-12-01 06:59:40,2025-12-27 05:07:28
6314,Castellanos y asociados S.Com. Modificado,solucionesguitartyasociadoss.l.@outlook.com,2022-07-04 01:41:35,2025-12-27 05:07:28
6315,Linares & Asociados S.Com. Modificado,hermanossernas.l.u.@hotmail.com,2022-11-29 18:31:05,2025-12-27 05:07:28
6317,Soluciones Calvo y asociados S.A.U Modificado,calvoyasociadoss.l.l.@outlook.com,2020-02-25 21:02:40,2025-12-27 05:07:28
6326,Hnos Vallés S.L.N.E Modificado,transportesuls.coop.@hotmail.com,2021-06-19 18:31:33,2025-12-27 05:07:28
6337,Fábrica Narváez & Asociados S.L. Modificado,montaña&asociadoss.a.@gmail.com,2021-06-02 12:49:56,2025-12-27 05:07:28
6338,Transportes Integrales S.C.P Modificado,comercialferreros.a.@outlook.com,2023-10-23 16:08:36,2025-12-27 05:07:28
6352,Español y Morales S.L.L. Modificado,canoyasociadoss.a.@outlook.com,2022-05-29 03:57:20,2025-12-27 05:07:28
6361,Felipa Llorente Paniagua S.L.N.E Modificado,familiabenítezs.l.n.e@gmail.com,2020-09-15 06:21:14,2025-12-27 05:07:28
6363,Construcción Pino S.L. Modificado,peñalver&asociadoss.l.n.e@outlook.com,2020-06-29 15:40:19,2025-12-27 05:07:28
6373,Hnos Castellanos S.Com. Modificado,consultoríaechevarrías.l.n.e@hotmail.com,2021-10-16 21:59:43,2025-12-27 05:07:28
6381,Taboada & Asociados S.C.P Modificado,planaysanmiguels.l.n.e@gmail.com,2022-05-17 00:33:57,2025-12-27 05:07:28
6392,Ortuño y Niño S.L.U. Modificado,cabreroycampss.l.n.e@hotmail.com,2020-07-08 14:42:21,2025-12-27 05:07:28
6401,Toribio Sans Ayllón S.Coop. Modificado,llobet&asociadoss.coop.@outlook.com,2020-05-28 12:14:58,2025-12-27 05:07:28
6402,Hnos Alcaraz S.L. Modificado,familiasegovias.a.t.@gmail.com,2021-09-28 06:13:53,2025-12-27 05:07:28
6405,Grupo Miranda S.L. Modificado,comercializadorawns.a.@hotmail.com,2024-03-26 10:56:04,2025-12-27 05:07:28
6408,Banca Privada del Norte S.L.N.E Modificado,maldonadoyasociadoss.a.@hotmail.com,2022-09-30 13:51:26,2025-12-27 05:07:28
6421,Prats & Asociados S.A. Modificado,manufacturaskxivs.com.@hotmail.com,2020-12-17 16:02:33,2025-12-27 05:07:28
6440,Sanmiguel y Solís S.L.N.E Modificado,gruponogueiras.coop.@hotmail.com,2021-10-17 13:45:35,2025-12-27 05:07:28
6453,Despacho BIJQ S.Coop. Modificado,despachoparedess.com.@hotmail.com,2020-11-23 16:55:53,2025-12-27 05:07:28
6459,Logística Ródenas & Asociados S.A.U Modificado,infraestructurasferreras.l.@hotmail.com,2020-08-11 16:51:50,2025-12-27 05:07:28
6470,Hnos Poza S.Com. Modificado,carmona&asociadoss.l.@hotmail.com,2020-07-07 03:55:39,2025-12-27 05:07:28
6472,Servicios KL S.L. Modificado,logísticainteligentess.l.@outlook.com,2023-06-06 04:59:51,2025-12-27 05:07:28
6486,Hotel Montaña S.L. Modificado,tecnologíascuéllars.l.n.e@gmail.com,2021-10-15 12:00:26,2025-12-27 05:07:28
6491,Salinas y Tena S.Coop. Modificado,hermanosquinteros.l.u.@hotmail.com,2022-08-01 02:14:01,2025-12-27 05:07:28
6506,Soluciones Milla S.Coop. Modificado,solucionesdelnortes.a.t.@outlook.com,2020-01-25 19:23:58,2025-12-27 05:07:28
6517,Grupo Santos S.A. Modificado,noriegayllabréss.com.@gmail.com,2021-09-14 06:24:02,2025-12-27 05:07:28
6519,Manufacturas Gámez S.A. Modificado,suministrosperezs.l.@gmail.com,2021-05-23 23:09:12,2025-12-27 05:07:28
6526,Instalaciones Román y asociados S.Com. Modificado,consultoríabeltrányasociadoss.com.@outlook.com,2023-06-11 11:34:04,2025-12-27 05:07:28
6548,Logística CNMO S.A.T. Modificado,hermanoscalvets.l.u.@outlook.com,2022-10-31 23:27:48,2025-12-27 05:07:28
6573,Roldán y Landa S.A. Modificado,inversionesrqfs.l.l.@outlook.com,2024-08-04 05:09:00,2025-12-27 05:07:28
6575,Inversiones Internacionales S.L. Modificado,santamaríayasociadoss.com.@outlook.com,2020-07-25 20:06:24,2025-12-27 05:07:28
6576,Madrigal y Rovira S.Com. Modificado,comercialdelnoroestes.a.@outlook.com,2023-12-22 11:04:25,2025-12-27 05:07:28
6579,Teresita Catalán Calzada S.Coop. Modificado,supermercadosgonzalos.coop.@outlook.com,2022-09-29 21:32:04,2025-12-27 05:07:28
6586,Construcción Echeverría y asociados S.Com. Modificado,carlosygallos.coop.@outlook.com,2021-08-20 16:34:03,2025-12-27 05:07:28
6592,Felisa Martinez Galiano S.Com. Modificado,despachocasanovas&asociadoss.a.@hotmail.com,2023-09-22 16:11:27,2025-12-27 05:07:28
6597,Infraestructuras Mateo S.Coop. Modificado,consultoríaintegraless.l.u.@hotmail.com,2023-12-08 07:48:40,2025-12-27 05:07:28
6600,Sánchez y asociados S.Coop. Modificado,manufacturasiafs.c.p@hotmail.com,2021-05-14 23:26:48,2025-12-27 05:07:28
6601,Castañeda y Ramos S.Coop. Modificado,sevillayhurtados.l.n.e@hotmail.com,2021-10-25 22:46:56,2025-12-27 05:07:28
6604,Transportes Iberia S.L. Modificado,melaniaenríquezsalinass.l.@outlook.com,2021-02-09 12:21:38,2025-12-27 05:07:28
6616,Compañía HZS S.Com. Modificado,tecnologíasdelsurs.a.@outlook.com,2020-05-25 23:50:15,2025-12-27 05:07:28
6622,Hnos Amorós S.Coop. Modificado,familiaaguados.a.@gmail.com,2022-07-05 12:10:56,2025-12-27 05:07:28
6628,Villena y Ochoa S.Coop. Modificado,pagèsymarís.com.@hotmail.com,2022-03-08 21:45:43,2025-12-27 05:07:28
6630,Valero y Tur S.A. Modificado,alimentaciónpeláezs.a.@outlook.com,2020-01-27 12:12:45,2025-12-27 05:07:28
6640,Servicios Badía y asociados S.Com. Modificado,romanymolinas.a.@hotmail.com,2023-08-08 20:51:14,2025-12-27 05:07:28
6643,Promociones Integrales S.Coop. Modificado,consultoríadelmediterráneos.com.@outlook.com,2024-01-10 15:41:59,2025-12-27 05:07:28
6646,Ortega y asociados S.A.T. Modificado,familiadiezs.com.@outlook.com,2020-10-09 09:53:41,2025-12-27 05:07:28
6647,Suministros HQ S.Coop. Modificado,logísticarus.com.@outlook.com,2024-04-07 10:04:13,2025-12-27 05:07:28
6685,Farmaceútica Barrios & Asociados S.L. Modificado,grupopiñols.c.p@outlook.com,2024-06-02 10:28:04,2025-12-27 05:07:28
6708,Promociones Feijoo S.L. Modificado,grupoaparicios.l.@outlook.com,2021-12-15 14:02:38,2025-12-27 05:07:28
6714,Ávila y Armengol S.Coop. Modificado,hnosvianas.l.@gmail.com,2020-04-18 02:56:06,2025-12-27 05:07:28
6720,Transportes Gomila S.A. Modificado,titorodríguezbarredas.l.n.e@gmail.com,2020-05-15 11:16:20,2025-12-27 05:07:28
6723,Comercial Ortega S.Coop. Modificado,granadosynogueras.a.@outlook.com,2024-02-24 09:45:30,2025-12-27 05:07:28
6726,Ildefonso Alcántara Arce S.L.U. Modificado,hnosverdejos.a.u@outlook.com,2020-10-23 09:38:21,2025-12-27 05:07:28
6732,Tolosa y Miró S.L.L. Modificado,elianaálvarezcáceress.l.@outlook.com,2020-09-14 00:24:15,2025-12-27 05:07:28
6744,Restauración del Norte S.Coop. Modificado,serviciosglobaless.coop.@outlook.com,2022-05-25 14:53:51,2025-12-27 05:07:28
6747,Hotel del Levante S.C.P Modificado,talleresestevezyasociadoss.coop.@hotmail.com,2021-07-10 01:01:28,2025-12-27 05:07:28
6775,Fábrica Española S.Coop. Modificado,comercializadoraavanzadass.l.@hotmail.com,2020-10-01 10:11:29,2025-12-27 05:07:28
6777,Consultoría del Mediterráneo S.Com. Modificado,hnosaraujos.l.@gmail.com,2020-03-27 06:06:02,2025-12-27 05:07:28
6782,Maza y Galan S.Coop. Modificado,promocionesalemanys.l.@hotmail.com,2022-11-11 14:03:43,2025-12-27 05:07:28
6784,Hermanos Benitez S.L. Modificado,arceyasociadoss.l.@outlook.com,2022-12-09 22:55:58,2025-12-27 05:07:28
6819,Barba y Román S.A.U Modificado,alegreypuigs.com.@hotmail.com,2022-04-09 04:45:12,2025-12-27 05:07:28
6830,Servicios Alcolea S.Coop. Modificado,paulinomachadofusters.coop.@gmail.com,2023-02-19 10:38:32,2025-12-27 05:07:28
6834,Fábrica Anglada y asociados S.Com. Modificado,construcciónuzzys.a.@hotmail.com,2020-06-17 19:03:56,2025-12-27 05:07:28
6836,Juan José Alcalá Gómez S.A. Modificado,alimentacióncabanillas&asociadoss.l.@hotmail.com,2020-01-24 01:58:59,2025-12-27 05:07:28
6843,Comercial Montaña S.Coop. Modificado,rojasyasociadoss.l.u.@gmail.com,2020-06-11 20:39:45,2025-12-27 05:07:28
6849,Grupo Cid S.Coop. Modificado,farmaceúticaperea&asociadoss.coop.@gmail.com,2022-12-23 09:18:59,2025-12-27 05:07:28
6869,Consultoría Azcona S.L. Modificado,mineríaocaña&asociadoss.coop.@outlook.com,2020-04-01 12:21:07,2025-12-27 05:07:28
6874,Industrias del Norte S.Coop. Modificado,brunoreciomárquezs.coop.@hotmail.com,2022-12-28 23:51:54,2025-12-27 05:07:28
6876,Logística BE S.A. Modificado,escribanoyasociadoss.coop.@outlook.com,2022-11-05 11:16:09,2025-12-27 05:07:28
6880,Despacho CM S.L. Modificado,farmaceúticaavanzadass.c.p@outlook.com,2024-05-30 12:41:57,2025-12-27 05:07:28
6907,Hotel Rivas S.L.N.E Modificado,industriasribass.coop.@gmail.com,2021-12-11 14:12:46,2025-12-27 05:07:28
6922,Distribuciones Ibéricos S.Com. Modificado,finanzascarbonells.l.l.@gmail.com,2020-07-17 23:14:44,2025-12-27 05:07:28
6954,Inversiones Chaves & Asociados S.Coop. Modificado,manufacturasosss.a.@outlook.com,2022-04-17 05:33:53,2025-12-27 05:07:28
6973,Pons y Galván S.Com. Modificado,solucionesdelmediterráneos.l.n.e@outlook.com,2021-05-13 18:52:24,2025-12-27 05:07:28
6981,Compañía Adán S.C.P Modificado,gerónimobonillamorillos.l.@gmail.com,2020-11-25 09:27:49,2025-12-27 05:07:28
6993,Luisa Oliva Fernández S.A. Modificado,familiaalmagros.com.@hotmail.com,2022-06-09 00:06:08,2025-12-27 05:07:28
6998,Aurelio Zabala Jurado S.Coop. Modificado,industriasmonteros.l.n.e@outlook.com,2024-12-26 10:08:50,2025-12-27 05:07:28
7010,Instalaciones Miguel S.L. Modificado,grupodalmaus.l.@gmail.com,2024-05-29 22:25:09,2025-12-27 05:07:28
7016,Hermanos Nicolás S.A. Modificado,calatayudyripolls.l.n.e@outlook.com,2022-12-19 08:35:13,2025-12-27 05:07:28
7024,Abellán y asociados S.L. Modificado,familiacarreras.l.n.e@gmail.com,2021-03-31 15:01:24,2025-12-27 05:07:28
7028,Industrias PIRZ S.A. Modificado,distribucionesiheqs.a.@outlook.com,2022-11-08 05:14:06,2025-12-27 05:07:28
7042,Minería OSS S.Com. Modificado,instalacionesibéricas.a.@hotmail.com,2020-02-19 10:46:11,2025-12-27 05:07:28
7045,Inversiones KLXV S.Coop. Modificado,bancohvos.l.n.e@gmail.com,2022-02-15 00:06:38,2025-12-27 05:07:28
7048,Tecnologías Vila & Asociados S.A. Modificado,restauraciónespañolass.coop.@gmail.com,2020-03-24 03:30:48,2025-12-27 05:07:28
7066,Supermercados Calderón S.L.N.E Modificado,hermanosgonzalos.com.@hotmail.com,2021-08-10 23:56:55,2025-12-27 05:07:28
7075,Comercializadora CNJI S.Com. Modificado,serviciosdominguez&asociadoss.coop.@hotmail.com,2020-12-01 21:28:33,2025-12-27 05:07:28
7086,René Valera Jordán S.L.N.E Modificado,farmaceúticaaguados.com.@hotmail.com,2020-06-04 14:11:01,2025-12-27 05:07:28
7088,Alemany y Mayo S.A. Modificado,bancobou&asociadoss.l.n.e@hotmail.com,2023-12-05 19:28:29,2025-12-27 05:07:28
7091,Barco y Ramirez S.A. Modificado,distribucionesbaeza&asociadoss.l.u.@gmail.com,2024-12-08 16:51:01,2025-12-27 05:07:28
7092,Industrias Integrales S.Coop. Modificado,aguilaryasociadoss.l.l.@gmail.com,2020-03-26 18:36:44,2025-12-27 05:07:28
7110,Hnos Seguí S.L. Modificado,suministrosbarrera&asociadoss.l.l.@outlook.com,2023-03-15 02:39:14,2025-12-27 05:07:28
7130,Quero y Castejón S.Coop. Modificado,bancoxks.com.@gmail.com,2020-01-01 08:00:49,2025-12-27 05:07:28
7132,Desarrollo Ocaña y asociados S.L.N.E Modificado,hotelibéricoss.coop.@gmail.com,2022-11-25 18:57:03,2025-12-27 05:07:28
7140,Industrias Font y asociados S.A.U Modificado,inmobiliariasoler&asociadoss.a.@gmail.com,2024-09-11 01:48:02,2025-12-27 05:07:28
7150,Haro y Nogueira S.Coop. Modificado,inmobiliariachicos.com.@gmail.com,2023-05-26 09:58:50,2025-12-27 05:07:28
7156,Restauración Ibéricos S.A.D Modificado,consultoríadelnoroestes.coop.@gmail.com,2022-10-05 23:38:16,2025-12-27 05:07:28
7169,Hnos Ortuño S.A. Modificado,bancokvs.com.@gmail.com,2021-09-11 18:59:52,2025-12-27 05:07:28
7171,Hnos Gallart S.L. Modificado,grupoferrándizs.a.@hotmail.com,2023-03-14 16:33:40,2025-12-27 05:07:28
7190,Laguna y Tejedor S.A. Modificado,hermanosfranchs.coop.@outlook.com,2020-07-10 19:15:35,2025-12-27 05:07:28
7197,Suministros Balaguer S.Com. Modificado,pugayasociadoss.coop.@hotmail.com,2022-02-12 16:09:04,2025-12-27 05:07:28
7220,Farmaceútica Bellido & Asociados S.L.U. Modificado,solucionesdelsurs.coop.@outlook.com,2023-10-08 17:27:06,2025-12-27 05:07:28
7232,Pavón y Sala S.L. Modificado,solucionesouqs.a.@outlook.com,2023-12-04 03:14:15,2025-12-27 05:07:28
7235,Hnos Perelló S.L. Modificado,compañíaestévez&asociadoss.l.@hotmail.com,2023-01-14 15:13:20,2025-12-27 05:07:28
7237,Olmo y asociados S.L. Modificado,familiacuetos.com.@hotmail.com,2024-11-11 09:20:36,2025-12-27 05:07:28
7238,Grupo Alonso S.A. Modificado,reyesygarridos.coop.@gmail.com,2022-02-18 13:03:54,2025-12-27 05:07:28
7271,Promociones Sáez S.L.N.E Modificado,finanzasybjs.com.@gmail.com,2024-08-18 13:47:41,2025-12-27 05:07:28
7285,Supermercados del Noroeste S.A.T. Modificado,esmeraldacerdádiezs.l.u.@outlook.com,2022-04-18 16:24:03,2025-12-27 05:07:28
7292,Calzada y asociados S.A.U Modificado,hotelibtrs.l.l.@hotmail.com,2020-10-10 18:31:43,2025-12-27 05:07:28
7321,Banco Avanzadas S.L.L. Modificado,promocionesrocha&asociadoss.com.@gmail.com,2021-02-24 13:51:05,2025-12-27 05:07:28
7324,Suministros CO S.Com. Modificado,familiamínguezs.coop.@gmail.com,2023-12-28 00:52:37,2025-12-27 05:07:28
7330,Minería NHEI S.L. Modificado,hnosvillas.coop.@hotmail.com,2020-01-07 22:23:46,2025-12-27 05:07:28
7356,Galván y Cañas S.L. Modificado,logísticadelnoroestes.c.p@gmail.com,2020-08-26 19:09:03,2025-12-27 05:07:28
7365,Servicios Escudero y asociados S.C.P Modificado,grupoporteros.com.@hotmail.com,2021-05-25 15:49:11,2025-12-27 05:07:28
7367,Teruel y Muñoz S.L.U. Modificado,josefranciscoripollaragóns.l.@outlook.com,2022-11-18 22:34:23,2025-12-27 05:07:28
7371,Tena y asociados S.A. Modificado,distribucionesavfxs.l.@hotmail.com,2021-10-14 13:18:17,2025-12-27 05:07:28
7374,Lisandro Llanos Gallego S.L. Modificado,consultoríablazquezyasociadoss.coop.@gmail.com,2021-08-12 20:45:48,2025-12-27 05:07:28
7376,Estévez y Villanueva S.A.U Modificado,mineríapuentes.l.n.e@gmail.com,2021-05-19 22:24:00,2025-12-27 05:07:28
7386,Solís y Santana S.Com. Modificado,alimentaciónarcoss.l.l.@gmail.com,2022-09-28 20:19:18,2025-12-27 05:07:28
7387,Finanzas YFT S.A. Modificado,luisacarvajalviñas.a.@hotmail.com,2022-11-28 12:26:50,2025-12-27 05:07:28
7392,Infraestructuras del Norte S.Coop. Modificado,fábricaglobaless.com.@hotmail.com,2022-04-26 18:36:29,2025-12-27 05:07:28
7397,Natalia Ordóñez Ariño S.L. Modificado,restauracióncabezayasociadoss.a.@gmail.com,2022-08-07 01:49:49,2025-12-27 05:07:28
7402,Soluciones Bernat S.A. Modificado,desarrolloespañolass.a.@outlook.com,2021-02-07 05:06:10,2025-12-27 05:07:28
7409,Despacho AHQ S.A. Modificado,servicioslagunayasociadoss.l.@hotmail.com,2023-02-13 16:00:28,2025-12-27 05:07:28
7428,Alimentación FTIO S.L.N.E Modificado,inversionesmontenegros.coop.@hotmail.com,2022-02-16 15:16:52,2025-12-27 05:07:28
7449,Construcción TEM S.A. Modificado,distribucionesfzs.a.@gmail.com,2022-01-29 11:34:36,2025-12-27 05:07:28
7454,Suministros del Sur S.L.U. Modificado,rosayasociadoss.coop.@outlook.com,2022-02-17 06:41:45,2025-12-27 05:07:28
7458,Banco OND S.L.N.E Modificado,tello&asociadoss.a.@hotmail.com,2020-03-26 19:54:53,2025-12-27 05:07:28
7464,Hermanos Prieto S.L. Modificado,hernandezyasociadoss.l.@gmail.com,2020-04-13 01:51:35,2025-12-27 05:07:28
7468,Banca Privada Ibérica S.L.N.E Modificado,bancaprivadacpks.l.n.e@outlook.com,2020-04-11 12:23:25,2025-12-27 05:07:28
7470,Dominguez y Nuñez S.Coop. Modificado,fábricaromeros.com.@gmail.com,2020-08-04 01:11:55,2025-12-27 05:07:28
7485,Familia Caparrós S.Coop. Modificado,instalacionesdelsurs.a.@gmail.com,2021-11-06 14:26:59,2025-12-27 05:07:28
7486,Hnos Morales S.Coop. Modificado,leonardorodacerdás.a.t.@hotmail.com,2021-02-27 13:27:17,2025-12-27 05:07:28
7488,Eustaquio Samper Salom S.Com. Modificado,instalacioneseds.l.l.@hotmail.com,2020-03-21 23:22:49,2025-12-27 05:07:28
7490,Transportes Globales S.A.T. Modificado,industriasinteligentess.a.@outlook.com,2021-07-06 09:58:10,2025-12-27 05:07:28
7493,Silvia Leon Viña S.L. Modificado,grupobayos.a.@outlook.com,2022-09-07 00:32:43,2025-12-27 05:07:28
7494,Jurado & Asociados S.Com. Modificado,poloyasociadoss.c.p@gmail.com,2023-07-15 22:28:52,2025-12-27 05:07:28
7505,Azcona & Asociados S.A. Modificado,grupoarenass.a.d@hotmail.com,2024-10-20 12:03:31,2025-12-27 05:07:28
7514,Logística Galván y asociados S.L.N.E Modificado,promocioneswfses.l.l.@outlook.com,2020-03-19 05:28:27,2025-12-27 05:07:28
7515,Consultoría Española S.L. Modificado,luísalberdiacuñas.coop.@hotmail.com,2020-01-29 17:11:05,2025-12-27 05:07:28
7518,Restauración del Noroeste S.L.U. Modificado,familiagarmendias.l.@outlook.com,2020-01-27 22:30:32,2025-12-27 05:07:28
7520,Correa y Tomé S.C.P Modificado,grupopeinados.a.@outlook.com,2022-01-26 14:08:14,2025-12-27 05:07:28
7551,Bartolomé Ángel Poza S.L. Modificado,construcciónxujns.a.@outlook.com,2023-06-29 10:31:15,2025-12-27 05:07:28
7554,Farmaceútica Barrena & Asociados S.A. Modificado,supermercadosnrms.a.u@hotmail.com,2020-12-08 09:13:35,2025-12-27 05:07:28
7555,Finanzas del Levante S.A.T. Modificado,instalacionesalonsos.coop.@gmail.com,2024-05-18 14:29:12,2025-12-27 05:07:28
7563,Hotel Roig S.L.N.E Modificado,patriciosoléamayas.com.@hotmail.com,2022-12-11 15:11:01,2025-12-27 05:07:28
7590,Hermanos Sastre S.L.L. Modificado,infraestructurasaragóns.l.u.@outlook.com,2021-05-01 03:27:12,2025-12-27 05:07:28
7591,Grupo Checa S.L. Modificado,consultoríamartorells.com.@gmail.com,2023-07-13 12:04:00,2025-12-27 05:07:28
7597,Hnos Castellanos S.Coop. Modificado,aránzazuríoasensios.a.@outlook.com,2021-07-30 21:05:41,2025-12-27 05:07:28
7609,Suministros Globales S.Com. Modificado,bancosuredas.l.@outlook.com,2024-12-09 15:09:55,2025-12-27 05:07:28
7629,Grupo Tomás S.A. Modificado,verdugoyasociadoss.l.l.@hotmail.com,2024-07-13 18:17:22,2025-12-27 05:07:28
7633,Desarrollo Vargas S.Coop. Modificado,almeidayasociadoss.l.@outlook.com,2021-05-18 23:41:06,2025-12-27 05:07:28
7637,Desarrollo KYKC S.L. Modificado,supermercadosabus.l.l.@gmail.com,2024-12-31 15:44:56,2025-12-27 05:07:28
7647,Petrona Pelayo Huguet S.Coop. Modificado,transportesflics.a.@gmail.com,2024-07-15 16:21:51,2025-12-27 05:07:28
7649,Infraestructuras Globales S.Coop. Modificado,logísticamontserrats.com.@hotmail.com,2021-07-24 22:10:52,2025-12-27 05:07:28
7654,Soluciones QAS S.Coop. Modificado,comercializadoraglobaless.a.@gmail.com,2022-12-29 03:25:57,2025-12-27 05:07:28
7655,Gonzalo y asociados S.L. Modificado,monteroyasociadoss.a.@outlook.com,2020-09-16 09:40:07,2025-12-27 05:07:28
7669,Grupo Valera S.Coop. Modificado,instalacionesags.com.@hotmail.com,2020-08-16 10:02:52,2025-12-27 05:07:28
7685,Asensio & Asociados S.Com. Modificado,yagohiguerasgarays.a.@hotmail.com,2022-02-12 02:12:08,2025-12-27 05:07:28
7713,Manufacturas Coronado S.L.L. Modificado,paolamolinerexpósitos.l.@hotmail.com,2022-05-16 03:42:44,2025-12-27 05:07:28
7746,Alimentación OQ S.A.T. Modificado,belénpozapalmas.l.n.e@hotmail.com,2021-08-05 13:11:30,2025-12-27 05:07:28
7754,Ballesteros & Asociados S.A. Modificado,jáureguiylasas.coop.@gmail.com,2022-03-02 19:39:45,2025-12-27 05:07:28
7757,Familia Delgado S.L. Modificado,rosauracampscortinas.coop.@gmail.com,2020-02-19 01:13:58,2025-12-27 05:07:28
7773,Hermanos Sanabria S.L. Modificado,ferrányasociadoss.com.@outlook.com,2021-11-02 05:34:22,2025-12-27 05:07:28
7774,Manufacturas Castellana S.C.P Modificado,familiacaballeros.a.u@outlook.com,2022-11-27 21:42:44,2025-12-27 05:07:28
7821,Banca Privada Ramirez S.L.L. Modificado,mineríamachados.com.@outlook.com,2021-12-19 01:38:13,2025-12-27 05:07:28
7853,Arcelia Diaz Ibarra S.Coop. Modificado,múgicaymendezs.com.@gmail.com,2021-04-06 04:00:52,2025-12-27 05:07:28
7855,Grupo Vilalta S.A.T. Modificado,antón&asociadoss.coop.@gmail.com,2021-01-22 15:52:29,2025-12-27 05:07:28
7865,Grupo Ríos S.L. Modificado,macariopalaciocepedas.l.@outlook.com,2024-07-30 20:47:07,2025-12-27 05:07:28
7877,Distribuciones PX S.A. Modificado,hotelpedroyasociadoss.l.@gmail.com,2021-03-27 06:23:28,2025-12-27 05:07:28
7896,Banco Soria S.L.N.E Modificado,serviciosnes.coop.@gmail.com,2024-12-22 14:53:37,2025-12-27 05:07:28
7897,Talleres HAPD S.A. Modificado,nazaretmanuelaceros.a.@outlook.com,2020-08-04 13:45:21,2025-12-27 05:07:28
7899,Llamas y asociados S.Com. Modificado,hilariodalmaucortéss.coop.@hotmail.com,2023-08-10 22:52:30,2025-12-27 05:07:28
7907,Cuesta y Álamo S.L.L. Modificado,arranzyroviras.a.d@outlook.com,2023-11-30 09:13:36,2025-12-27 05:07:28
7914,Grupo Linares S.Coop. Modificado,familiacorreas.a.@outlook.com,2024-09-07 06:55:24,2025-12-27 05:07:28
7919,Haroldo León Reina S.Com. Modificado,grupopujadass.a.@hotmail.com,2020-03-13 21:17:04,2025-12-27 05:07:28
7926,Grupo Gisbert S.L. Modificado,infanteyrubios.l.n.e@hotmail.com,2021-05-25 13:08:53,2025-12-27 05:07:28
7929,Paloma Hernández Aragonés S.L. Modificado,hoteloiss.coop.@outlook.com,2021-05-03 18:20:15,2025-12-27 05:07:28
7936,Inmobiliaria Álvarez S.C.P Modificado,desarrollogalianos.a.@hotmail.com,2021-07-29 04:06:00,2025-12-27 05:07:28
7946,Transportes Bernad S.Com. Modificado,alimentaciónlds.coop.@outlook.com,2020-01-16 11:34:33,2025-12-27 05:07:28
7947,Hermanos Chico S.A. Modificado,mineríagámez&asociadoss.l.n.e@outlook.com,2022-06-04 01:03:15,2025-12-27 05:07:28
7963,Rojas y Donoso S.L. Modificado,playgarmendias.coop.@gmail.com,2022-01-18 08:18:43,2025-12-27 05:07:28
7965,Distribuciones Españolas S.Com. Modificado,grupoalcarazs.a.@hotmail.com,2020-08-29 06:07:26,2025-12-27 05:07:28
7970,Abril Acedo Rodriguez S.L. Modificado,méndezylucass.l.@hotmail.com,2021-02-20 01:05:36,2025-12-27 05:07:28
7999,Desarrollo HSU S.Coop. Modificado,logísticapáezyasociadoss.l.n.e@gmail.com,2021-02-13 08:40:16,2025-12-27 05:07:28
8003,Desarrollo PBS S.L.N.E Modificado,hnosorozcos.com.@outlook.com,2021-02-19 14:02:35,2025-12-27 05:07:28
8030,Banco Morán y asociados S.Coop. Modificado,brígidalucenabartolomés.l.l.@outlook.com,2021-01-06 21:38:58,2025-12-27 05:07:28
8037,Restauración Águila y asociados S.Com. Modificado,serranoyasociadoss.a.@gmail.com,2022-04-24 06:14:01,2025-12-27 05:07:28
8040,Marco y Casals S.A. Modificado,bayónyrouras.com.@hotmail.com,2023-02-04 22:19:53,2025-12-27 05:07:28
8051,Antón y asociados S.L. Modificado,serviciosantóns.l.n.e@outlook.com,2021-10-12 20:52:17,2025-12-27 05:07:28
8059,Cuervo y Sandoval S.A. Modificado,amoyasociadoss.a.t.@gmail.com,2024-12-16 21:58:42,2025-12-27 05:07:28
8062,Gaya y asociados S.L. Modificado,josepreciorodriguezs.l.n.e@gmail.com,2020-02-15 06:52:22,2025-12-27 05:07:28
8067,Logística LYC S.A. Modificado,lobo&asociadoss.l.n.e@outlook.com,2021-06-25 08:25:31,2025-12-27 05:07:28
8071,Mena y asociados S.L.L. Modificado,evangelinaserramoratas.l.@gmail.com,2021-11-02 11:38:36,2025-12-27 05:07:28
8080,Comercializadora Globales S.L.N.E Modificado,hermanosvillenas.l.u.@gmail.com,2020-09-14 22:07:00,2025-12-27 05:07:28
8084,Terrón y asociados S.Coop. Modificado,familiagalváns.a.@outlook.com,2020-04-27 23:36:40,2025-12-27 05:07:28
